2487	Piza Jr;S De T	Duas novas aranhas oxyópidas do Brasil	Boletim Biológico Sao Paulo (N.S.)			3		47	48	1938					http://www.wsc.nmbe.ch/reference/2487		Piza Jr., S. de T. (1938b). Duas novas aranhas oxyópidas do Brasil. Boletim Biológico Sao Paulo (N.S.) 3: 47-48.
2488	C F Roewer	Araneae. In: Résultats scientifiques du Voyage aux indes orientales néerlandaises de la SS. AA. RR. le Prince et la Princesse Leopold de Belgique	Mémoires du Musée Royal d'Histoire Naturelle de Belgique			3	19	1	94	1938					http://www.wsc.nmbe.ch/reference/2488		Roewer, C. F. (1938). Araneae. In: Résultats scientifiques du Voyage aux indes orientales néerlandaises de la SS. AA. RR. le Prince et la Princesse Leopold de Belgique. Mémoires du Musée Royal d'Histoire Naturelle de Belgique 3(19), 1-94.
2489	E Schenkel	Die Arthropodenfauna von Madeira nach den Ergebnissen der Reise von Prof. Dr O. Lundblad, Juli-August 1935	Arkiv för Zoologi			30	A7	1	42	1938					http://www.wsc.nmbe.ch/reference/2489		Schenkel, E. (1938a). Die Arthropodenfauna von Madeira nach den Ergebnissen der Reise von Prof. Dr O. Lundblad, Juli-August 1935. Arkiv för Zoologi 30(A7): 1-42.
2490	E Schenkel	Spinnentiere von der Iberischen Halbinsel, gesammelt von Prof. Dr O. Lundblad, 1935	Arkiv för Zoologi			30	A24	1	29	1938					http://www.wsc.nmbe.ch/reference/2490		Schenkel, E. (1938b). Spinnentiere von der Iberischen Halbinsel, gesammelt von Prof. Dr O. Lundblad, 1935. Arkiv för Zoologi 30(A24): 1-29.
2491	V Šilhavý	Pavouk Xysticus embriki Kolosváry v Československé Republice	Časopis Československé Společnosti Entomologické			35		36	38	1938					http://www.wsc.nmbe.ch/reference/2491		Šilhavý, V. (1938). Pavouk Xysticus embriki Kolosváry v Československé Republice. Časopis Československé Společnosti Entomologické 35: 36-38.
2492	S A Spassky	Araneae palaearcticae novae. II	Festschrift Embrik Strand			4		573	582	1938					http://www.wsc.nmbe.ch/reference/2492		Spassky, S. A. (1938). Araneae palaearcticae novae. II. Festschrift Embrik Strand 4: 573-582.
2493	T Uyemura	Reports on some Japanese spiders (2)	Acta Arachnologica			3		19	30	1938					http://www.wsc.nmbe.ch/reference/2493		Uyemura, T. (1938a). Reports on some Japanese spiders (2). Acta Arachnologica 3: 19-30.
2494	T Uyemura	Two new spiders from Wakayama Prefecture, Japan	Acta Arachnologica			3		90	95	1938					http://www.wsc.nmbe.ch/reference/2494		Uyemura, T. (1938b). Two new spiders from Wakayama Prefecture, Japan. Acta Arachnologica 3: 90-95.
2495	T Uyemura	Bansaia nipponica, a new genus and new species of Japanese spider	Acta Arachnologica			3		132	141	1938					http://www.wsc.nmbe.ch/reference/2495		Uyemura, T. (1938c). Bansaia nipponica, a new genus and new species of Japanese spider. Acta Arachnologica 3: 132-141.
2496	J Braendegaard	Arctosa alpigena Doleschall 1852 og Arctosa insignita Thorell 1872	Meddelelser om Grønland			108	7	5	12	1939					http://www.wsc.nmbe.ch/reference/2496		Braendegaard, J. (1939). Arctosa alpigena Doleschall 1852 og Arctosa insignita Thorell 1872. Meddelelser om Grønland 108(7): 5-12.
2497	W S Bristowe	The Comity of Spiders	Ray Society, London, vol.			1		228		1939					http://www.wsc.nmbe.ch/reference/2497		Bristowe, W. S. (1939). The Comity of Spiders. Ray Society, London, vol. 1, 228 pp.
2498	L Di Caporiacco	Arachnida. In: Missione biologica nel paese dei Borana. Raccolte zoologiche	Reale Accademia d'Italia, Roma			3		303	385	1939					http://www.wsc.nmbe.ch/reference/2498		Caporiacco, L. di (1939a). Arachnida. In: Missione biologica nel paese dei Borana. Raccolte zoologiche. Reale Accademia d'Italia, Roma 3, 303-385.
2499	L Di Caporiacco	Aracnidi cavernicoli delle Puglie	Le Grotte d'Italia, Trieste (2a)			3		43	47	1939					http://www.wsc.nmbe.ch/reference/2499		Caporiacco, L. di (1939b). Aracnidi cavernicoli delle Puglie. Le Grotte d'Italia, Trieste (2a) 3: 43-47.
2500	R V Chamberlin;W Ivie	Studies on North American spiders of the family Micryphantidae. Verhandlungen, VII	Internationaler Kongress für Entomologie, Berlin			1		56	73	1939					http://www.wsc.nmbe.ch/reference/2500		Chamberlin, R. V. & Ivie, W. (1939a). Studies on North American spiders of the family Micryphantidae. Verhandlungen, VII. Internationaler Kongress für Entomologie, Berlin 1: 56-73.
2501	R V Chamberlin;W Ivie	New tarantulas from the southwestern states	Bulletin of the University of Utah			29	11	1	17	1939					http://www.wsc.nmbe.ch/reference/2501		Chamberlin, R. V. & Ivie, W. (1939b). New tarantulas from the southwestern states. Bulletin of the University of Utah 29(11): 1-17.
2502	D E Charitonov	On the cave spiders of Abkhasia						197	210	1939					http://www.wsc.nmbe.ch/reference/2502		Charitonov, D. E. (1939). On the cave spiders of Abkhasia. In: Material' k faune Abchazii. Academie des Sciences l’URSS, Filiale Georgienne, Section de Zoologie, pp. 197-210.
2503	A M Chickering	Anyphaenidae and Clubionidae of Michigan	Papers of the Michigan Academy of Science, Arts and Letters			24		49	84	1939					http://www.wsc.nmbe.ch/reference/2503		Chickering, A. M. (1939). Anyphaenidae and Clubionidae of Michigan. Papers of the Michigan Academy of Science, Arts and Letters 24: 49-84.
2504	M Dahl	Berichtigungen	Mitteilungen über Höhlen- und Karstforschung 1939:			48		136		1939					http://www.wsc.nmbe.ch/reference/2504		Dahl, M. (1939). Berichtigungen. Mitteilungen über Höhlen- und Karstforschung 1939: 48, 136.
2505	J Denis	Description d'un Zodarion nouveau du Portugal	Bulletin de la Société Entomologique de France			44		89	92	1939					http://www.wsc.nmbe.ch/reference/2505		Denis, J. (1939a). Description d'un Zodarion nouveau du Portugal. Bulletin de la Société Entomologique de France 44: 89-92.
2506	J Denis	Sur quelques araignées françaises recueillies en 1938	Revue Française d'Entomologie			6		73	79	1939					http://www.wsc.nmbe.ch/reference/2506		Denis, J. (1939b). Sur quelques araignées françaises recueillies en 1938. Revue Française d'Entomologie 6: 73-79.
2507	P Drensky	Über die Identifizierung einiger Spinnenarten, die von Dr. Al. Roșca (1935 u. 1936) als neu für die Bukowina (Rumänien) beschrieben wurden	Izwestia na Beulgarskoto Entomologitschesko Droujestwo Sofia			10		85	87	1939					http://www.wsc.nmbe.ch/reference/2507		Drensky, P. (1939a). Über die Identifizierung einiger Spinnenarten, die von Dr. Al. Roșca (1935 u. 1936) als neu für die Bukowina (Rumänien) beschrieben wurden. Izwestia na Beulgarskoto Entomologitschesko Droujestwo Sofia 10: 85-87.
2508	P Drensky	Faounata na Paiatzite (Araneae) w Beulgaria. III. Podrazred Arachnomorphae; II klon Trionychia; semeystwa: Urocteidae; Uloboridae; Sicaridae; Pholcidae; Eresidae	Izvestiya na Tsarskite Prirodonauchni Instituti v Sofia			12		231	252	1939					http://www.wsc.nmbe.ch/reference/2508		Drensky, P. (1939b). Faounata na Paiatzite (Araneae) w Beulgaria. III. Podrazred Arachnomorphae; II klon Trionychia; semeystwa: Urocteidae; Uloboridae; Sicaridae; Pholcidae; Eresidae. Izvestiya na Tsarskite Prirodonauchni Instituti v Sofia 12: 231-252.
2509	W J Gertsch	A new genus in the Pholcidae	American Museum Novitates			1033		1	4	1939					http://www.wsc.nmbe.ch/reference/2509		Gertsch, W. J. (1939a). A new genus in the Pholcidae. American Museum Novitates 1033: 1-4.
2510	W J Gertsch	A revision of the typical crab spiders (Misumeninae) of America north of Mexico	Bulletin of the American Museum of Natural History			76		277	442	1939					http://www.wsc.nmbe.ch/reference/2510		Gertsch, W. J. (1939b). A revision of the typical crab spiders (Misumeninae) of America north of Mexico. Bulletin of the American Museum of Natural History 76: 277-442.
2511	W J Gertsch	Report on a collection of Arachnida from the Chisos Mountains	Contributions from Baylor University Museum			24		17	26	1939					http://www.wsc.nmbe.ch/reference/2511		Gertsch, W. J. (1939c). Report on a collection of Arachnida from the Chisos Mountains. Contributions from Baylor University Museum 24: 17-26.
2512	W J Gertsch;W L Jellison	Notes on a collection of spiders from Montana	American Museum Novitates			1032		1	13	1939					http://www.wsc.nmbe.ch/reference/2512		Gertsch, W. J. & Jellison, W. L. (1939). Notes on a collection of spiders from Montana. American Museum Novitates 1032: 1-13.
2513	V V Hickman	On a dipneumone spider (Risdonius parvus, gen. et sp. n.), the female of which has reduced palpi	Proceedings of the Zoological Society of London (B)			108		655	660	1939					http://www.wsc.nmbe.ch/reference/2513		Hickman, V. V. (1939a). On a dipneumone spider (Risdonius parvus, gen. et sp. n.), the female of which has reduced palpi. Proceedings of the Zoological Society of London (B) 108: 655-660.
2514	V V Hickman	Opiliones and Araneae. In: B.A. New Zealand Antarctic Research Expedition 1929-1931. Reports-Series B	Adelaide			4	5	157	188	1939					http://www.wsc.nmbe.ch/reference/2514		Hickman, V. V. (1939b). Opiliones and Araneae. In: B.A. New Zealand Antarctic Research Expedition 1929-1931. Reports-Series B. Adelaide 4(5), 157-188.
2515	Å Holm	Araneae. In: Hale Carpenter, G. D., & Å. Holm (eds.) Insecta and Araneae collected in the Kangerdlugsuak Region of East Greenland by the British Expedition, 1935-36	Annals and Magazine of Natural History 11			3		72	80	1939					http://www.wsc.nmbe.ch/reference/2515		Holm, Å. (1939a). Araneae. In: Hale Carpenter, G. D., & Å. Holm (eds.) Insecta and Araneae collected in the Kangerdlugsuak Region of East Greenland by the British Expedition, 1935-36. Annals and Magazine of Natural History 11 3, 72-80.
2516	Å Holm	Neue Spinnen aus Schweden. Beschreibung neuer Arten der Familien Drassidae, Theridiidae, Linyphiidae und Micryphantidae	Arkiv för Zoologi			31	A8	1	38	1939					http://www.wsc.nmbe.ch/reference/2516		Holm, Å. (1939b). Neue Spinnen aus Schweden. Beschreibung neuer Arten der Familien Drassidae, Theridiidae, Linyphiidae und Micryphantidae. Arkiv för Zoologi 31(A8): 1-38.
2517	I Kayashima	On the male of Peucetia formosensis Kishida (Oxyopidae)	Transactions of the Natural History Society of Formosa			29		36	38	1939					http://www.wsc.nmbe.ch/reference/2517		Kayashima, I. (1939). On the male of Peucetia formosensis Kishida (Oxyopidae). Transactions of the Natural History Society of Formosa 29: 36-38.
2518	G Kolosváry	Neue Spinnenfaunistische Angaben aus Ungarn	Zoologischer Anzeiger			125		43	47	1939					http://www.wsc.nmbe.ch/reference/2518		Kolosváry, G. (1939a). Neue Spinnenfaunistische Angaben aus Ungarn. Zoologischer Anzeiger 125: 43-47.
2519	G Kolosváry	Der erste Fund von reifen Weibchen der Art Nemesia pannonica O. Herman var. budense Kolosváry	Zoologischer Anzeiger			127		264	266	1939					http://www.wsc.nmbe.ch/reference/2519		Kolosváry, G. (1939b). Der erste Fund von reifen Weibchen der Art Nemesia pannonica O. Herman var. budense Kolosváry. Zoologischer Anzeiger 127: 264-266.
2520	G Kolosváry	Verzeichnis der auf der III. ungarischen wissenschaftlichen Adria-Exkursion gesammelten Landtiere in Dalmatien 1938	Festschrift Embrik Strand			5		131	138	1939					http://www.wsc.nmbe.ch/reference/2520		Kolosváry, G. (1939c). Verzeichnis der auf der III. ungarischen wissenschaftlichen Adria-Exkursion gesammelten Landtiere in Dalmatien 1938. Festschrift Embrik Strand 5: 131-138.
2521	T Komatsu	Touch-thread makers; Uroctea, Ariadna, Segestria	Acta Arachnologica			4		99	105	1939					http://www.wsc.nmbe.ch/reference/2521		Komatsu, T. (1939). Touch-thread makers; Uroctea, Ariadna, Segestria. Acta Arachnologica 4: 99-105.
2522	J Kratochvíl	À propos des deux araignées cavernicoles de Yougoslavie	Věstník Československé Zoologické Společnosti v Praze			6-7		279	289	1939					http://www.wsc.nmbe.ch/reference/2522		Kratochvíl, J. (1939). À propos des deux araignées cavernicoles de Yougoslavie. Věstník Československé Zoologické Společnosti v Praze 6-7: 279-289.
2523	J Kratochvíl;F Miller	Espèces nouvelles cavernicoles du genre Paraleptoneta (aranéides) découvertes en Yougoslavie	Archives de Zoologie Expérimentale et Générale			80	N. & Rev.	96	115	1939					http://www.wsc.nmbe.ch/reference/2523		Kratochvíl, J. & Miller, F. (1939). Espèces nouvelles cavernicoles du genre Paraleptoneta (aranéides) découvertes en Yougoslavie. Archives de Zoologie Expérimentale et Générale 80(N. & Rev.): 96-115.
2524	T B Kurata	A list of the spiders of York County, Ontario, Cabada	The Canadian Field-Naturalist			53		80	83	1939					http://www.wsc.nmbe.ch/reference/2524		Kurata, T. B. (1939). A list of the spiders of York County, Ontario, Cabada. The Canadian Field-Naturalist 53: 80-83.
2525	R F Lawrence	The genus Haemilla (Araneae) in South Africa	Annals of the Natal Museum			9		269	281	1939					http://www.wsc.nmbe.ch/reference/2525		Lawrence, R. F. (1939). The genus Haemilla (Araneae) in South Africa. Annals of the Natal Museum 9: 269-281.
2526	R Lessert	Araignées du Congo belge (Deuxieme partie)	Revue de Zoologie et de Botanique Africaines			32		1	13	1939					http://www.wsc.nmbe.ch/reference/2526		Lessert, R. (1939). Araignées du Congo belge (Deuxieme partie). Revue de Zoologie et de Botanique Africaines 32: 1-13.
2527	A De B Machado	Trois nouvelles araignées cavernicoles de l'Espagne	Bulletin de la Société Zoologique de France			64		60	70	1939					http://www.wsc.nmbe.ch/reference/2527		Machado, A. de B. (1939). Trois nouvelles araignées cavernicoles de l'Espagne. Bulletin de la Société Zoologique de France 64: 60-70.
2528	C F De Mello-Leitão	Algunos aracnidos de Sudamerica	Revista Chilena de Historia Natural			43		169	176	1939					http://www.wsc.nmbe.ch/reference/2528		Mello-Leitão, C. F. de (1939a). Algunos aracnidos de Sudamerica. Revista Chilena de Historia Natural 43: 169-176.
2529	C F De Mello-Leitão	Une araignée argentine type d'une sous-famille nouvelle (Corinoctenus anomalostomus n. sp.)	Physis, Revista de la Sociedad Argentina de Ciencias Naturales			17		137	142	1939					http://www.wsc.nmbe.ch/reference/2529		Mello-Leitão, C. F. de (1939b). Une araignée argentine type d'une sous-famille nouvelle (Corinoctenus anomalostomus n. sp.). Physis, Revista de la Sociedad Argentina de Ciencias Naturales 17: 137-142.
2530	C F De Mello-Leitão	A propos d'un nouveau oonopide myrmecophile de l'Argentine	Physis, Revista de la Sociedad Argentina de Ciencias Naturales			17		143	145	1939					http://www.wsc.nmbe.ch/reference/2530		Mello-Leitão, C. F. de (1939c). A propos d'un nouveau oonopide myrmecophile de l'Argentine. Physis, Revista de la Sociedad Argentina de Ciencias Naturales 17: 143-145.
2531	C F De Mello-Leitão	Les arachnides et la zoogéographie de l'Argentine	Physis, Revista de la Sociedad Argentina de Ciencias Naturales			17		601	630	1939					http://www.wsc.nmbe.ch/reference/2531		Mello-Leitão, C. F. de (1939d). Les arachnides et la zoogéographie de l'Argentine. Physis, Revista de la Sociedad Argentina de Ciencias Naturales 17: 601-630.
2532	C F De Mello-Leitão	Araignées américaines du Musee d'histoire naturelle de Bâle	Revue Suisse de Zoologie			46		43	93	1939				10.5962/bhl.part.117928	http://www.wsc.nmbe.ch/reference/2532		Mello-Leitão, C. F. de (1939e). Araignées américaines du Musee d'histoire naturelle de Bâle. Revue Suisse de Zoologie 46: 43-93.
2533	C F De Mello-Leitão	Algumas aranhas de S.-Paulo e Santa Catarina	Memórias do Instituto Butantan			12		523	531	1939					http://www.wsc.nmbe.ch/reference/2533		Mello-Leitão, C. F. de (1939f). Algumas aranhas de S.-Paulo e Santa Catarina. Memórias do Instituto Butantan 12: 523-531.
2534	C F De Mello-Leitão	Some new argiopid spiders of British Guiana taken by Mr C. W. Richards from the nests of solitary wasps	Anais da Academia Brasileira de Ciências			11		105	112	1939					http://www.wsc.nmbe.ch/reference/2534		Mello-Leitão, C. F. de (1939g). Some new argiopid spiders of British Guiana taken by Mr C. W. Richards from the nests of solitary wasps. Anais da Academia Brasileira de Ciências 11: 105-112.
2535	C F De Mello-Leitão	Aracnidos Anex I ao Relat. Excurs. cient. Inst. O. Quiz	Boletim Biológico Sao Paulo (N.S.)			4		281	294	1939					http://www.wsc.nmbe.ch/reference/2535		Mello-Leitão, C. F. de (1939h). Aracnidos Anex I ao Relat. Excurs. cient. Inst. O. Quiz. Boletim Biológico Sao Paulo (N.S.) 4: 281-294.
2536	F Miller	Trichoncus vejdovskyi n. sp. (Araneae)	Věstník Československé Zoologické Společnosti v Praze			6-7		318	321	1939					http://www.wsc.nmbe.ch/reference/2536		Miller, F. (1939). Trichoncus vejdovskyi n. sp. (Araneae). Věstník Československé Zoologické Společnosti v Praze 6-7: 318-321.
2537	F Miller;J Kratochvíl	Einige neue Spinnen aus Mitteleuropa	Sborník Entomologického Oddělení Národního Musea v Praze			17	164	32	38	1939					http://www.wsc.nmbe.ch/reference/2537		Miller, F. & Kratochvíl, J. (1939). Einige neue Spinnen aus Mitteleuropa. Sborník Entomologického Oddělení Národního Musea v Praze 17(164): 32-38.
2538	P Palmgren	Die Spinnenfauna Finnlands. I. Lycosidae	Acta Zoologica Fennica			25		1	86	1939					http://www.wsc.nmbe.ch/reference/2538		Palmgren, P. (1939). Die Spinnenfauna Finnlands. I. Lycosidae. Acta Zoologica Fennica 25: 1-86.
2539	A Petrunkevitch	Catalogue of American spiders. Part one	Transactions of the Connecticut Academy of Arts and Sciences			33		133	338	1939					http://www.wsc.nmbe.ch/reference/2539		Petrunkevitch, A. (1939a). Catalogue of American spiders. Part one. Transactions of the Connecticut Academy of Arts and Sciences 33: 133-338.
2540	A Petrunkevitch	The status of the genus Eurypelma (order Araneae, family Theraphosidae)	Annals and Magazine of Natural History (11)			4		561	568	1939					http://www.wsc.nmbe.ch/reference/2540		Petrunkevitch, A. (1939b). The status of the genus Eurypelma (order Araneae, family Theraphosidae). Annals and Magazine of Natural History (11) 4: 561-568.
2541	A Petrunkevitch	The status of the family Archaeidae and the genus Landana	Annals of the Entomological Society of America			32		479	501	1939				10.1093/aesa/32.3.479	http://www.wsc.nmbe.ch/reference/2541		Petrunkevitch, A. (1939c). The status of the family Archaeidae and the genus Landana. Annals of the Entomological Society of America 32: 479-501.
2542	Piza Jr;S De T	Novas aranhas do Brasil	Revista de Agricultura, Piracicaba			14	7-8	1	8	1939					http://www.wsc.nmbe.ch/reference/2542		Piza Jr., S. de T. (1939a). Novas aranhas do Brasil. Revista de Agricultura, Piracicaba 14(7-8): 1-8.
2543	Piza Jr;S De T	Um novo gênero de aranha do Brasil	Jornal de Agronomia, Piracicaba			2		385	386	1939					http://www.wsc.nmbe.ch/reference/2543		Piza Jr., S. de T. (1939b). Um novo gênero de aranha do Brasil. Jornal de Agronomia, Piracicaba 2: 385-386.
2544	E Reimoser	Wissenschaftliche Ergebnisse der österreichischen biologischen Expedition nach Costa Rica. Die Spinnenfauna	Annalen des Naturhistorischen Museums in Wien			50		328	386	1939					http://www.wsc.nmbe.ch/reference/2544		Reimoser, E. (1939). Wissenschaftliche Ergebnisse der österreichischen biologischen Expedition nach Costa Rica. Die Spinnenfauna. Annalen des Naturhistorischen Museums in Wien 50: 328-386.
2545	A Roșca	Neue Spinnenarten aus der Dobrogea (Rumänien)	Zoologischer Anzeiger			125		91	96	1939					http://www.wsc.nmbe.ch/reference/2545		Roșca, A. (1939). Neue Spinnenarten aus der Dobrogea (Rumänien). Zoologischer Anzeiger 125: 91-96.
2547	E Schenkel	Beitrag zur Spinnenkunde	Revue Suisse de Zoologie			46		95	114	1939					http://www.wsc.nmbe.ch/reference/2547		Schenkel, E. (1939). Beitrag zur Spinnenkunde. Revue Suisse de Zoologie 46: 95-114.
2548	W R Sherriffs	Hong-Kong spiders. Part V	Hong-kong Naturalist			9		135	140	1939					http://www.wsc.nmbe.ch/reference/2548		Sherriffs, W. R. (1939a). Hong-Kong spiders. Part V. Hong-kong Naturalist 9: 135-140.
2549	W R Sherriffs	Hong-Kong spiders. Part VI	Hong-kong Naturalist			9		193	198	1939					http://www.wsc.nmbe.ch/reference/2549		Sherriffs, W. R. (1939b). Hong-Kong spiders. Part VI. Hong-kong Naturalist 9: 193-198.
2550	S A Spassky	Araneae palaearcticae novae. III	Festschrift Embrik Strand			5		138	144	1939					http://www.wsc.nmbe.ch/reference/2550		Spassky, S. A. (1939a). Araneae palaearcticae novae. III. Festschrift Embrik Strand 5: 138-144.
2551	S A Spassky	Araneae palaearcticae novae. IV	Folia Zoologica et Hydrobiologica, Rigā			9		299	308	1939					http://www.wsc.nmbe.ch/reference/2551		Spassky, S. A. (1939b). Araneae palaearcticae novae. IV. Folia Zoologica et Hydrobiologica, Rigā 9: 299-308.
2552	T Uyemura	A new lycosid spider from Fukui Prefecture, Japan	Acta Arachnologica			4		130	133	1939					http://www.wsc.nmbe.ch/reference/2552		Uyemura, T. (1939a). A new lycosid spider from Fukui Prefecture, Japan. Acta Arachnologica 4: 130-133.
2553	T Uyemura	[Habit and description of Acusilas coccineus]	Acta Arachnologica			4		139	145	1939					http://www.wsc.nmbe.ch/reference/2553		Uyemura, T. (1939b). [Habit and description of Acusilas coccineus]. Acta Arachnologica 4: 139-145.
2554	H Wiehle	Die einheimischen Tetragnatha Arten	Nova Acta Leopoldina, Abhandlungen der Kaiserlich Leopoldinisch-Carolinisch Deutschen Akademie der Naturforscher (N.F.)			6		363	386	1939					http://www.wsc.nmbe.ch/reference/2554		Wiehle, H. (1939). Die einheimischen Tetragnatha Arten. Nova Acta Leopoldina, Abhandlungen der Kaiserlich Leopoldinisch-Carolinisch Deutschen Akademie der Naturforscher (N.F.) 6: 363-386.
2555	T Yaginuma	[A description of the male of Itatsina dorsilineata]	Acta Arachnologica			4		106	109	1939					http://www.wsc.nmbe.ch/reference/2555		Yaginuma, T. (1939). [A description of the male of Itatsina dorsilineata]. Acta Arachnologica 4: 106-109.
2556	A F Archer	The Argiopidae or orb-weaving spiders of Alabama	Museum Paper, Geological Survey of Alabama			14		1	77	1940					http://www.wsc.nmbe.ch/reference/2556		Archer, A. F. (1940). The Argiopidae or orb-weaving spiders of Alabama. Museum Paper, Geological Survey of Alabama 14: 1-77.
2557	A Bacelar	Aracnídeos portugueses VI (continuação do inventário dos aracnideos)	Boletim da Sociedade Portuguesa de Ciencias Naturais			13		99	110	1940					http://www.wsc.nmbe.ch/reference/2557		Bacelar, A. (1940). Aracnídeos portugueses VI (continuação do inventário dos aracnideos). Boletim da Sociedade Portuguesa de Ciencias Naturais 13: 99-110.
2558	W M Barrows	New and rare spiders from the Great Smoky Mountain National Park region	Ohio Journal of Science			40		130	138	1940					http://www.wsc.nmbe.ch/reference/2558		Barrows, W. M. (1940). New and rare spiders from the Great Smoky Mountain National Park region. Ohio Journal of Science 40: 130-138.
2559	L Berland;J Millot	Les araignées de l'Afrique occidental français. II, Cribellata	Annales de la Société Entomologique de France			108		149	160	1940					http://www.wsc.nmbe.ch/reference/2559		Berland, L. & Millot, J. (1940). Les araignées de l'Afrique occidental français. II, Cribellata. Annales de la Société Entomologique de France 108: 149-160.
2560	J Braendegaard	I. Spiders (Araneina) from northeast Greenland between lats. 70⁰25' and 76⁰50' N. II. On the possibility of a reliable determination of species of the females of the genus Erigone	Meddelelser om Grønland			125	8	1	29	1940					http://www.wsc.nmbe.ch/reference/2560		Braendegaard, J. (1940). I. Spiders (Araneina) from northeast Greenland between lats. 70⁰25' and 76⁰50' N. II. On the possibility of a reliable determination of species of the females of the genus Erigone. Meddelelser om Grønland 125(8): 1-29. ("Literature": p. [30]-[31])
2561	E B Bryant	Cuban spiders in the Museum of Comparative Zoology	Bulletin of the Museum of Comparative Zoology at Harvard College			86		247	532	1940					http://www.wsc.nmbe.ch/reference/2561		Bryant, E. B. (1940). Cuban spiders in the Museum of Comparative Zoology. Bulletin of the Museum of Comparative Zoology at Harvard College 86: 247-532.
2562	E B Bryant;A F Archer	Notes on Epeira pentagona Hentz	Psyche, Cambridge			47		60	65	1940					http://www.wsc.nmbe.ch/reference/2562		Bryant, E. B. & Archer, A. F. (1940). Notes on Epeira pentagona Hentz. Psyche, Cambridge 47: 60-65.
2563	L Di Caporiacco	Arachniden aus der Province Verona (Norditalien)	Folia Zoologica et Hydrobiologica, Rigā			10		1	37	1940					http://www.wsc.nmbe.ch/reference/2563		Caporiacco, L. di (1940a). Arachniden aus der Province Verona (Norditalien). Folia Zoologica et Hydrobiologica, Rigā 10: 1-37.
2564	L Di Caporiacco	Alcuni aracnidi di Somalia. Bollettino del Laboratorio di Zoologia Generale e Agraria della R	Scuola Superiore d'Agricoltura in Portici			31		295	305	1940					http://www.wsc.nmbe.ch/reference/2564		Caporiacco, L. di (1940b). Alcuni aracnidi di Somalia. Bollettino del Laboratorio di Zoologia Generale e Agraria della R. Scuola Superiore d'Agricoltura in Portici 31: 295-305.
2565	L Di Caporiacco	Aracnidi raccolte nella Reg. dei Laghi Etiopici della Fossa Galla	Atti della Reale Accademia d'Italia			11		767	873	1940					http://www.wsc.nmbe.ch/reference/2565		Caporiacco, L. di (1940c). Aracnidi raccolte nella Reg. dei Laghi Etiopici della Fossa Galla. Atti della Reale Accademia d'Italia 11: 767-873.
2566	L Di Caporiacco	Due ragni nuovi dello Scioa	Redia			27		19	23	1940					http://www.wsc.nmbe.ch/reference/2566		Caporiacco, L. di (1940d). Due ragni nuovi dello Scioa. Redia 27: 19-23.
2567	R V Chamberlin	New American tarantulas of the family Aviculariidae	Bulletin of the University of Utah			30	13	1	39	1940					http://www.wsc.nmbe.ch/reference/2567		Chamberlin, R. V. (1940a). New American tarantulas of the family Aviculariidae. Bulletin of the University of Utah 30(13): 1-39.
2568	R V Chamberlin	A new trap-door spider from Texas	Proceedings of the Biological Society of Washington			53		5	6	1940					http://www.wsc.nmbe.ch/reference/2568		Chamberlin, R. V. (1940b). A new trap-door spider from Texas. Proceedings of the Biological Society of Washington 53: 5-6.
