3060	J Denis	Araignées recueillies à Tenerife (Iles Canaries)	Bulletin de l'Institut Royal des Sciences Naturelles de Belgique			29	39	1	8	1953					http://www.wsc.nmbe.ch/reference/3060		Denis, J. (1953c). Araignées recueillies à Tenerife (Iles Canaries). Bulletin de l'Institut Royal des Sciences Naturelles de Belgique 29(39): 1-8.
3061	J Denis	Spiders of the Yemen, southwest Arabia, collected by the U.S. Naval Medical mission to the Yemen, 1951	Transactions of the American Microscopical Society			72		337	343	1953					http://www.wsc.nmbe.ch/reference/3061		Denis, J. (1953b). Spiders of the Yemen, southwest Arabia, collected by the U.S. Naval Medical mission to the Yemen, 1951. Transactions of the American Microscopical Society 72: 337-343.
3062	R L Gering	Sructure and function of the genitalia in some American agelenid spiders	Smithsonian Miscellaneous Collections			121	4	1	84	1953					http://www.wsc.nmbe.ch/reference/3062		Gering, R. L. (1953). Sructure and function of the genitalia in some American agelenid spiders. Smithsonian Miscellaneous Collections 121(4): 1-84.
3063	W J Gertsch	The spider genera Xysticus, Coriarachne and Oxyptila (Thomisidae, Misumeninae) in North America	Bulletin of the American Museum of Natural History			102		415	482	1953					http://www.wsc.nmbe.ch/reference/3063		Gertsch, W. J. (1953). The spider genera Xysticus, Coriarachne and Oxyptila (Thomisidae, Misumeninae) in North America. Bulletin of the American Museum of Natural History 102: 415-482.
3064	A I Hassan	The Oecobiidae of Egypt	Bulletin - Zoological Society of Egypt			11		14	28	1953					http://www.wsc.nmbe.ch/reference/3064		Hassan, A. I. (1953). The Oecobiidae of Egypt. Bulletin - Zoological Society of Egypt 11: 14-28.
3065	B M Klein	Spinnenhochzeit	Mikrokosmos			43		1	3	1953					http://www.wsc.nmbe.ch/reference/3065		Klein, B. M. (1953). Spinnenhochzeit. Mikrokosmos 43: 1-3.
3066	H W Levi	New and rare Dipoena from Mexico and Central America (Araneae, Theridiidae)	American Museum Novitates			1639		1	11	1953					http://www.wsc.nmbe.ch/reference/3066		Levi, H. W. (1953a). New and rare Dipoena from Mexico and Central America (Araneae, Theridiidae). American Museum Novitates 1639: 1-11.
3067	H W Levi	Spiders of the genus Dipoena from America north of Mexico (Araneae, Theridiidae)	American Museum Novitates			1647		1	39	1953					http://www.wsc.nmbe.ch/reference/3067		Levi, H. W. (1953b). Spiders of the genus Dipoena from America north of Mexico (Araneae, Theridiidae). American Museum Novitates 1647: 1-39.
3068	G H Locket;A F Millidge	British spiders	Ray Society, London			1		1	449	1953					http://www.wsc.nmbe.ch/reference/3068		Locket, G. H. & Millidge, A. F. (1953). British spiders. Ray Society, London 1, 1-449.
3069	I Mikulska	Pająk						70		1953		Panstowe Wydawnictwo Naukowe	Warsaw		http://www.wsc.nmbe.ch/reference/3069		Mikulska, I. (1953). Pająk. Panstowe Wydawnictwo Naukowe, Warsaw, 70 pp.
3070	M H Muma	A study of the spider family Selenopidae in North and Central America and the West Indies	American Museum Novitates			1619		1	55	1953					http://www.wsc.nmbe.ch/reference/3070		Muma, M. H. (1953). A study of the spider family Selenopidae in North and Central America and the West Indies. American Museum Novitates 1619: 1-55.
3071	C F Roewer	Cavernicole arachniden aus Sardinien	Notes biospéologiques			8		39	49	1953					http://www.wsc.nmbe.ch/reference/3071		Roewer, C. F. (1953a). Cavernicole arachniden aus Sardinien. Notes biospéologiques 8: 39-49.
3072	C F Roewer	Araneae-Orthognatha (Arachnoidae)	Exploration du Parc National de l'Upemba, Mission G. F. de Witte			22		1	80	1953					http://www.wsc.nmbe.ch/reference/3072		Roewer, C. F. (1953b). Araneae-Orthognatha (Arachnoidae). Exploration du Parc National de l'Upemba, Mission G. F. de Witte 22: 1-80.
3073	E Schenkel	Bericht über einige Spinnentiere aus Venezuela	Verhandlungen der Naturforschenden Gesellschaft in Basel			64		1	57	1953					http://www.wsc.nmbe.ch/reference/3073		Schenkel, E. (1953a). Bericht über einige Spinnentiere aus Venezuela. Verhandlungen der Naturforschenden Gesellschaft in Basel 64: 1-57.
3074	E Schenkel	Chinesische Arachnoidea aus dem Museum Hoangho-Peiho in Tientsin	Boletim do Museu Nacional do Rio de Janeiro (N.S., Zool.)			119		1	108	1953					http://www.wsc.nmbe.ch/reference/3074		Schenkel, E. (1953b). Chinesische Arachnoidea aus dem Museum Hoangho-Peiho in Tientsin. Boletim do Museu Nacional do Rio de Janeiro (N.S., Zool.) 119: 1-108.
3076															http://www.wsc.nmbe.ch/reference/3076		Wiehle, H. (1953). Spinnentiere oder Arachnoidea (Araneae) IX: Orthognatha-Cribellatae-Haplogynae-Entelegynae (Pholcidae, Zodariidae, Oxyopidae, Mimetidae, Nesticidae). Tierwelt Deutschlands 42: i-viii, 1-150.
3076															http://www.wsc.nmbe.ch/reference/3076		Wiehle, H. (1953). Spinnentiere oder Arachnoidea (Araneae) IX: Orthognatha-Cribellatae-Haplogynae-Entelegynae (Pholcidae, Zodariidae, Oxyopidae, Mimetidae, Nesticidae). Tierwelt Deutschlands 42: i-viii, 1-150.
3077	T Yaginuma	On two spiders of Japanese Leucauge	Atypus			4		28	29	1953					http://www.wsc.nmbe.ch/reference/3077		Yaginuma, T. (1953). On two spiders of Japanese Leucauge. Atypus 4: 28-29.
3079	M Birabén	Nuevas Gamasomorphinae de la Argentina (Araneae, Oonopidae)	Notas del Museo de la Plata			17		181	212	1954					http://www.wsc.nmbe.ch/reference/3079		Birabén, M. (1954a). Nuevas Gamasomorphinae de la Argentina (Araneae, Oonopidae). Notas del Museo de la Plata 17: 181-212.
3080	M Birabén	Nuevo genero de la rara familia Prodidomidae	Neotropica			1		13	16	1954					http://www.wsc.nmbe.ch/reference/3080		Birabén, M. (1954b). Nuevo genero de la rara familia Prodidomidae. Neotropica 1: 13-16.
3081	M Birabén	Nueva especie de Nops (Araneae-Caponiidae)	Neotropica			1		43	44	1954					http://www.wsc.nmbe.ch/reference/3081		Birabén, M. (1954c). Nueva especie de Nops (Araneae-Caponiidae). Neotropica 1: 43-44.
3082	E Browning	The accidental importation of three species of Torania into Great Britain, with observations on live specimens (Araneae: Sparassidae)	Proceedings of the Zoological Society of London			124		213	217	1954				10.1111/j.1469-7998.1954.tb07778.x	http://www.wsc.nmbe.ch/reference/3082		Browning, E. (1954). The accidental importation of three species of Torania into Great Britain, with observations on live specimens (Araneae: Sparassidae). Proceedings of the Zoological Society of London 124: 213-217.
3083	L Di Caporiacco	Araignées de la Guyane Française du Muséum d'Histoire Naturelle de Paris	Commentationes Pontificia Academia Scientiarum			16		45	193	1954					http://www.wsc.nmbe.ch/reference/3083		Caporiacco, L. di (1954). Araignées de la Guyane Française du Muséum d'Histoire Naturelle de Paris. Commentationes Pontificia Academia Scientiarum 16: 45-193.
3084	D E Charitonov	Novii predstavitel 'roda Latrodectus iz Turkmenii (Latrodectus pallidus O. P. Cambr. subsp. pavlovskii n.)	Zoologicheskiĭ Zhurnal			33		480	485	1954					http://www.wsc.nmbe.ch/reference/3084		Charitonov, D. E. (1954). Novii predstavitel 'roda Latrodectus iz Turkmenii (Latrodectus pallidus O. P. Cambr. subsp. pavlovskii n.). Zoologicheskiĭ Zhurnal 33: 480-485.
3085	A M Chickering	The spider genus Mangora (Argiopidae) in Panama	Bulletin of the Museum of Comparative Zoology at Harvard College			111		195	215	1954					http://www.wsc.nmbe.ch/reference/3085		Chickering, A. M. (1954). The spider genus Mangora (Argiopidae) in Panama. Bulletin of the Museum of Comparative Zoology at Harvard College 111: 195-215.
3086	W Crome	Beschreibung, Morphologie und Lebensweise der Eucta kaestneri sp. n. (Araneae, Tetragnathidae)	Zoologische Jahrbücher (Syst.)			82		425	452	1954					http://www.wsc.nmbe.ch/reference/3086		Crome, W. (1954). Beschreibung, Morphologie und Lebensweise der Eucta kaestneri sp. n. (Araneae, Tetragnathidae). Zoologische Jahrbücher (Syst.) 82: 425-452.
3087	M Czajka	Chiracanthium elegans Thorell - novel arachnidean species in the Polish fauna	Polskie Pismo Entomologiczne			24		169	172	1954					http://www.wsc.nmbe.ch/reference/3087		Czajka, M. (1954). Chiracanthium elegans Thorell - novel arachnidean species in the Polish fauna. Polskie Pismo Entomologiczne 24: 169-172.
3059	J Denis	Quelques captures d'araignées Pyrénéennes	Bulletin de la Société d'Histoire Naturelle de Toulouse 88(3-4, 1953): 259-266. N.B.: year corrected from 1953 to 1954 by Canard &amp; Cruveillier,			2016		43		1954					http://www.wsc.nmbe.ch/reference/3059		Denis, J. (1954d). Quelques captures d'araignées Pyrénéennes. Bulletin de la Société d'Histoire Naturelle de Toulouse 88(3-4, 1953): 259-266. N.B.: year corrected from 1953 to 1954 by Canard &amp; Cruveillier, 2016: 43.
3088	J Denis	Araignées recueillies par P. Remy du Sud-Algérien au Hoggar	Bulletin de la Société Zoologique de France			78		311	324	1954					http://www.wsc.nmbe.ch/reference/3088		Denis, J. (1954a). Araignées recueillies par P. Remy du Sud-Algérien au Hoggar. Bulletin de la Société Zoologique de France 78: 311-324.
3089	J Denis	Notes d'aranéologie marocaine. III. Quelques araignées du massif de l'Ayachi, avec une étude sur les Textrix du Maroc	Revue Française d'Entomologie			21		132	144	1954					http://www.wsc.nmbe.ch/reference/3089		Denis, J. (1954b). Notes d'aranéologie marocaine. III. Quelques araignées du massif de l'Ayachi, avec une étude sur les Textrix du Maroc. Revue Française d'Entomologie 21: 132-144.
3090	J Denis	Araignées des environs d'Espingo (Haute-Garonne)	Bulletin de la Société d'Histoire Naturelle de Toulouse			89		137	156	1954					http://www.wsc.nmbe.ch/reference/3090		Denis, J. (1954c). Araignées des environs d'Espingo (Haute-Garonne). Bulletin de la Société d'Histoire Naturelle de Toulouse 89: 137-156.
3091	E Dresco	Description d'une araignée cavernicole nouvelle du genre Paraleptoneta	Notes biospéologiques			9		45	48	1954					http://www.wsc.nmbe.ch/reference/3091		Dresco, E. (1954). Description d'une araignée cavernicole nouvelle du genre Paraleptoneta. Notes biospéologiques 9: 45-48.
3092	E Duffey;G H Locket;A F Millidge	On some spiders collected in East Suffolk and Essex	Annals and Magazine of Natural History (12)			7		474	478	1954					http://www.wsc.nmbe.ch/reference/3092		Duffey, E., Locket, G. H. & Millidge, A. F. (1954). On some spiders collected in East Suffolk and Essex. Annals and Magazine of Natural History (12) 7: 474-478.
3093	E Duffey;A F Millidge	Centromerus incilium (L. Koch), a linyphiid spider taken near Oxford, with notes on related species	Journal of the Society of British Entomologists			4		218	223	1954					http://www.wsc.nmbe.ch/reference/3093		Duffey, E. & Millidge, A. F. (1954). Centromerus incilium (L. Koch), a linyphiid spider taken near Oxford, with notes on related species. Journal of the Society of British Entomologists 4: 218-223.
3094	Gerschman De P;B S ;R D Schiapelli	Una nueva Theraphosidae del género Homoeomma Ausserer, 1871 (Araneae)	Physis, Revista de la Sociedad Argentina de Ciencias Naturales			20		420	423	1954					http://www.wsc.nmbe.ch/reference/3094		Gerschman de P., B. S. & Schiapelli, R. D. (1954). Una nueva Theraphosidae del género Homoeomma Ausserer, 1871 (Araneae). Physis, Revista de la Sociedad Argentina de Ciencias Naturales 20: 420-423.
3095	L Gonzalez T	Latrodectus mactans mexicanus subsp. nov	Anales del Instituto Biológico de la Universidad Nacional Autónoma de México			24		455	457	1954					http://www.wsc.nmbe.ch/reference/3095		Gonzalez T., L. (1954). Latrodectus mactans mexicanus subsp. nov. Anales del Instituto Biológico de la Universidad Nacional Autónoma de México 24: 455-457.
3096	W Hackman	The spiders of Newfoundland	Acta Zoologica Fennica			79		1	99	1954					http://www.wsc.nmbe.ch/reference/3096		Hackman, W. (1954). The spiders of Newfoundland. Acta Zoologica Fennica 79: 1-99.
3097	K H Hyatt	The African spiders of the family Ctenidae in the collections of the British Museum (Natural History)	Annals and Magazine of Natural History (12)			7		877	894	1954					http://www.wsc.nmbe.ch/reference/3097		Hyatt, K. H. (1954). The African spiders of the family Ctenidae in the collections of the British Museum (Natural History). Annals and Magazine of Natural History (12) 7: 877-894.
3098	A Ibarra G	Una nueva Acanthoscurria de Bolivia (Araneae, Theraphosidae)	Neotropica			1		19	22	1954					http://www.wsc.nmbe.ch/reference/3098		Ibarra G., A. (1954). Una nueva Acanthoscurria de Bolivia (Araneae, Theraphosidae). Neotropica 1: 19-22.
3099	W Knülle	Lycosa purbeckensis F. O. P. Cambridge (Lycosidae: Araneae), eine deutsche Küstenart: Ein Beitrag zur Taxonomie der Lycosa-monticola-Gruppe	Kieler Meeresforschungen			10		68	76	1954					http://www.wsc.nmbe.ch/reference/3099		Knülle, W. (1954a). Lycosa purbeckensis F. O. P. Cambridge (Lycosidae: Araneae), eine deutsche Küstenart: Ein Beitrag zur Taxonomie der Lycosa-monticola-Gruppe. Kieler Meeresforschungen 10: 68-76.
3100	W Knülle	Gynandromorphie bei Erigone vagans spinosa Cambr. (Micryphantidae: Araneae)	Zoologischer Anzeiger			152		219	227	1954					http://www.wsc.nmbe.ch/reference/3100		Knülle, W. (1954b). Gynandromorphie bei Erigone vagans spinosa Cambr. (Micryphantidae: Araneae). Zoologischer Anzeiger 152: 219-227.
3101	W Knülle	Zur Taxonomie und Ökologie der norddeutschen Arten der Spinnen-Gattung Erigone Aud	Zoologische Jahrbücher, Abteilung für Systematik, Geographie und Biologie der Tiere			83		63	110	1954					http://www.wsc.nmbe.ch/reference/3101		Knülle, W. (1954c). Zur Taxonomie und Ökologie der norddeutschen Arten der Spinnen-Gattung Erigone Aud. Zoologische Jahrbücher, Abteilung für Systematik, Geographie und Biologie der Tiere 83: 63-110.
3102	H W Levi	Spiders of the new genus Theridiotis (Araneae: Theridiidae)	Transactions of the American Microscopical Society			73		177	189	1954					http://www.wsc.nmbe.ch/reference/3102		Levi, H. W. (1954a). Spiders of the new genus Theridiotis (Araneae: Theridiidae). Transactions of the American Microscopical Society 73: 177-189.
3103	H W Levi	Spiders of the genus Euryopis from North and Central America (Araneae, Theridiidae)	American Museum Novitates			1666		1	48	1954					http://www.wsc.nmbe.ch/reference/3103		Levi, H. W. (1954b). Spiders of the genus Euryopis from North and Central America (Araneae, Theridiidae). American Museum Novitates 1666: 1-48.
3104	H W Levi	The spider genus Theridula in North and Central America and the West Indies (Araneae: Theridiidae)	Transactions of the American Microscopical Society			73		331	343	1954					http://www.wsc.nmbe.ch/reference/3104		Levi, H. W. (1954c). The spider genus Theridula in North and Central America and the West Indies (Araneae: Theridiidae). Transactions of the American Microscopical Society 73: 331-343.
3105	H W Levi;H M Field	The spiders of Wisconsin	American Midland Naturalist			51		440	467	1954				10.2307/2422118	http://www.wsc.nmbe.ch/reference/3105		Levi, H. W. & Field, H. M. (1954). The spiders of Wisconsin. American Midland Naturalist 51: 440-467.
3106	B Y Main	Spiders and Opiliones. In: The Archipelago of the Recherche	Australian Geographic Society Reports			1		37	53	1954					http://www.wsc.nmbe.ch/reference/3106		Main, B. Y. (1954). Spiders and Opiliones. In: The Archipelago of the Recherche. Australian Geographic Society Reports 1, 37-53.
3107	A F Millidge	On a new species and genus of spider	Annals and Magazine of Natural History (12)			7		253	256	1954					http://www.wsc.nmbe.ch/reference/3107		Millidge, A. F. (1954). On a new species and genus of spider. Annals and Magazine of Natural History (12) 7: 253-256.
3108	V D Roth	Review of the spider subgenus Barronopsis (Arachnida, Agelenidae)	American Museum Novitates			1678		1	7	1954					http://www.wsc.nmbe.ch/reference/3108		Roth, V. D. (1954). Review of the spider subgenus Barronopsis (Arachnida, Agelenidae). American Museum Novitates 1678: 1-7.
3109	G Schmidt	Zur Herkunftsbestimmung von Bananenimporten nach dem Besatz an Spinnen	Zeitschrift für Angewandte Zoologie			36		400	422	1954				10.1111/j.1439-0418.1954.tb00769.x	http://www.wsc.nmbe.ch/reference/3109		Schmidt, G. (1954). Zur Herkunftsbestimmung von Bananenimporten nach dem Besatz an Spinnen. Zeitschrift für Angewandte Zoologie 36: 400-422.
3110	H Tambs-Lyche	Arachnoidea from South Georgia and the Crozet Islands with remarks on the subfamily Masoninae	The Norwegian-British-Swedish Antarctic Expedition 1949-52, Scientific Results			35		1	19	1954					http://www.wsc.nmbe.ch/reference/3110		Tambs-Lyche, H. (1954). Arachnoidea from South Georgia and the Crozet Islands with remarks on the subfamily Masoninae. The Norwegian-British-Swedish Antarctic Expedition 1949-52, Scientific Results 35: 1-19.
3111	T Yaginuma	Note on the Japanese spiders Leucauge (included a new species)	Arachnological News			2		1	4	1954					http://www.wsc.nmbe.ch/reference/3111		Yaginuma, T. (1954a). Note on the Japanese spiders Leucauge (included a new species). Arachnological News 2: 1-4.
3112	T Yaginuma	Synopsis of Japanese spiders (1)	Atypus			5		13	24	1954					http://www.wsc.nmbe.ch/reference/3112		Yaginuma, T. (1954b). Synopsis of Japanese spiders (1). Atypus 5: 13-24.
3113	T Yaginuma	Synopsis of Japanese spiders (2)	Atypus			6		9	16	1954					http://www.wsc.nmbe.ch/reference/3113		Yaginuma, T. (1954c). Synopsis of Japanese spiders (2). Atypus 6: 9-16.
3114	T Yaginuma	Synopsis of Japanese spiders (3)	Atypus			7		13	20	1954					http://www.wsc.nmbe.ch/reference/3114		Yaginuma, T. (1954d). Synopsis of Japanese spiders (3). Atypus 7: 13-20.
3115	T Yaginuma	On the scientific name of nusa-gumo (Argiopidae)	Atypus			7		25	27	1954					http://www.wsc.nmbe.ch/reference/3115		Yaginuma, T. (1954e). On the scientific name of nusa-gumo (Argiopidae). Atypus 7: 25-27.
3116	M Bačescu	La soie des tubes aériens de l'araignée Atypus piceus Sulzer. Buletin Stiintific	Sectia de Biologic si Stiinte Agricole			7		1127	1136	1955					http://www.wsc.nmbe.ch/reference/3116		Bačescu, M. (1955). La soie des tubes aériens de l'araignée Atypus piceus Sulzer. Buletin Stiintific. Sectia de Biologic si Stiinte Agricole 7: 1127-1136.
3117	R D Barnes	North American jumping spiders of the genus Maevia	American Museum Novitates			1746		1	13	1955					http://www.wsc.nmbe.ch/reference/3117		Barnes, R. D. (1955). North American jumping spiders of the genus Maevia. American Museum Novitates 1746: 1-13.
3118	M Birabén	Dos tomisidos neuvos de Bolivia (Araneae)	Publicaciones de la Misión de Estudios de Patologia Regional Argentina, Jujuy			26	85-86	73	77	1955					http://www.wsc.nmbe.ch/reference/3118		Birabén, M. (1955a). Dos tomisidos neuvos de Bolivia (Araneae). Publicaciones de la Misión de Estudios de Patologia Regional Argentina, Jujuy 26(85-86): 73-77.
3119	M Birabén	Dos nuevos oonopidos de la Argentina	Neotropica			1		73	76	1955					http://www.wsc.nmbe.ch/reference/3119		Birabén, M. (1955b). Dos nuevos oonopidos de la Argentina. Neotropica 1: 73-76.
3120	P Bonnet	Bibliographia araneorum	Toulouse			2	1	1	918	1955					http://www.wsc.nmbe.ch/reference/3120		Bonnet, P. (1955). Bibliographia araneorum. Toulouse 2(1), 1-918.
3121	L Di Caporiacco	Estudios sobre los aracnidos de Venezuela. 2a parte: Araneae	Acta Biologica Venezuelica			1		265	448	1955					http://www.wsc.nmbe.ch/reference/3121		Caporiacco, L. di (1955). Estudios sobre los aracnidos de Venezuela. 2a parte: Araneae. Acta Biologica Venezuelica 1: 265-448.
3122	H Casemir	Die Spinnenfauna der Hülserbruches bei Krefeld	Gewässer Abwässer			8		24	51	1955					http://www.wsc.nmbe.ch/reference/3122		Casemir, H. (1955). Die Spinnenfauna der Hülserbruches bei Krefeld. Gewässer Abwässer 8: 24-51.
3123	D E Charitonov	Redkii predstavitel paukov poda Latrodectus Walck. (Aranea) iz Turkmenii	Trudy Zoologieskogo Instituta Akademija Nauk SSSR			18		243	247	1955					http://www.wsc.nmbe.ch/reference/3123		Charitonov, D. E. (1955). Redkii predstavitel paukov poda Latrodectus Walck. (Aranea) iz Turkmenii. Trudy Zoologieskogo Instituta Akademija Nauk SSSR 18: 243-247.
3124	A M Chickering	The genus Eustala (Araneae, Argiopidae) in Central America	Bulletin of the Museum of Comparative Zoology at Harvard College			112		391	518	1955					http://www.wsc.nmbe.ch/reference/3124		Chickering, A. M. (1955). The genus Eustala (Araneae, Argiopidae) in Central America. Bulletin of the Museum of Comparative Zoology at Harvard College 112: 391-518.
3125	Y Chikuni	Five interesting spiders from Japan highlands	Acta Arachnologica			14		29	40	1955					http://www.wsc.nmbe.ch/reference/3125		Chikuni, Y. (1955). Five interesting spiders from Japan highlands. Acta Arachnologica 14: 29-40.
3126	P Chrysanthus	Notes on spiders I	Entomologische Berichten, Amsterdam			15		301	303	1955					http://www.wsc.nmbe.ch/reference/3126		Chrysanthus, P. (1955a). Notes on spiders I. Entomologische Berichten, Amsterdam 15: 301-303.
3127	P Chrysanthus	Notes on spiders II	Entomologische Berichten, Amsterdam			15		518	520	1955					http://www.wsc.nmbe.ch/reference/3127		Chrysanthus, P. (1955b). Notes on spiders II. Entomologische Berichten, Amsterdam 15: 518-520.
3128	P Chrysanthus	On defectively regenerated palps in male spiders	Natuurhistorisch Maandblad			44		56	59	1955					http://www.wsc.nmbe.ch/reference/3128		Chrysanthus, P. (1955c). On defectively regenerated palps in male spiders. Natuurhistorisch Maandblad 44: 56-59.
3129	A Comellini	Notes sur les Thomisidae d'Afrique	Revue de Zoologie et de Botanique Africaines			51		117	126	1955					http://www.wsc.nmbe.ch/reference/3129		Comellini, A. (1955). Notes sur les Thomisidae d'Afrique. Revue de Zoologie et de Botanique Africaines 51: 117-126.
3130	J Denis	Araignées. In: Mission Henri Coiffait au Liban (1951)	Archives de Zoologie Expérimentale et Générale			91	Biospeol. 75	437	454	1955					http://www.wsc.nmbe.ch/reference/3130		Denis, J. (1955a). Araignées. In: Mission Henri Coiffait au Liban (1951). Archives de Zoologie Expérimentale et Générale 91(Biospeol. 75), 437-454.
3131	J Denis	Contribution à l'étude de l'Aïr (Mission L. Chopard et A. Villiers). Araignées	Bulletin de l'Institut Fondamental d'Afrique Noire			17	A	99	146	1955					http://www.wsc.nmbe.ch/reference/3131		Denis, J. (1955b). Contribution à l'étude de l'Aïr (Mission L. Chopard et A. Villiers). Araignées. Bulletin de l'Institut Fondamental d'Afrique Noire 17(A): 99-146.
3132	J Denis	Speologica africana: quelques araignées cavernicoles de Guinée française	Bulletin de l'Institut Fondamental d'Afrique Noire			17	A	1024	1033	1955					http://www.wsc.nmbe.ch/reference/3132		Denis, J. (1955c). Speologica africana: quelques araignées cavernicoles de Guinée française. Bulletin de l'Institut Fondamental d'Afrique Noire 17(A): 1024-1033.
3133	J Denis	Notes d'aranéologie marocaine. IV. Araignées recueillies à Ifrane par M. L. Chopard	Bulletin du Muséum National d'Histoire Naturelle de Paris			27		207	211	1955					http://www.wsc.nmbe.ch/reference/3133		Denis, J. (1955d). Notes d'aranéologie marocaine. IV. Araignées recueillies à Ifrane par M. L. Chopard. Bulletin du Muséum National d'Histoire Naturelle de Paris 27: 207-211.
3134	J Denis	Araignées du Tibesti récoltées par M. P. de Mire	Bulletin, Office National Anti-Acridien, Alger			5		1	8	1955					http://www.wsc.nmbe.ch/reference/3134		Denis, J. (1955e). Araignées du Tibesti récoltées par M. P. de Mire. Bulletin, Office National Anti-Acridien, Alger 5: 1-8.
3135	J Denis	Recherches d'araignées dans les Pyrénées Centrales (de Barèges à Gavarnie)	Bulletin de la Société d'Histoire Naturelle de Toulouse			90		142	156	1955					http://www.wsc.nmbe.ch/reference/3135		Denis, J. (1955f). Recherches d'araignées dans les Pyrénées Centrales (de Barèges à Gavarnie). Bulletin de la Société d'Histoire Naturelle de Toulouse 90: 142-156.
3136	R R Forster	A new family of spiders of the sub-order Hypochilomorphae	Pacific Science			9		277	285	1955					http://www.wsc.nmbe.ch/reference/3136		Forster, R. R. (1955a). A new family of spiders of the sub-order Hypochilomorphae. Pacific Science 9: 277-285.
3137	R R Forster	Spiders of the family Archaeidae from Australia and New Zealand	Transactions and Proceedings of the Royal Society of New Zealand			83		391	403	1955					http://www.wsc.nmbe.ch/reference/3137		Forster, R. R. (1955b). Spiders of the family Archaeidae from Australia and New Zealand. Transactions and Proceedings of the Royal Society of New Zealand 83: 391-403.
3138	R R Forster	Spiders from the subantarctic islands of New Zealand	Records of the Dominion Museum, Wellington			2		167	203	1955					http://www.wsc.nmbe.ch/reference/3138		Forster, R. R. (1955c). Spiders from the subantarctic islands of New Zealand. Records of the Dominion Museum, Wellington 2: 167-203.
3139	W J Gertsch	The North American bolas spiders of the genera Mastophora and Agatostichus	Bulletin of the American Museum of Natural History			106		221	254	1955					http://www.wsc.nmbe.ch/reference/3139		Gertsch, W. J. (1955). The North American bolas spiders of the genera Mastophora and Agatostichus. Bulletin of the American Museum of Natural History 106: 221-254.
3140	W J Gertsch;W Ivie	The spider genus Neon in North America	American Museum Novitates			1743		1	17	1955					http://www.wsc.nmbe.ch/reference/3140		Gertsch, W. J. & Ivie, W. (1955). The spider genus Neon in North America. American Museum Novitates 1743: 1-17.
3141	J E Hull	British spiders: recent and amended records	Annals and Magazine of Natural History (12)			8		49	56	1955					http://www.wsc.nmbe.ch/reference/3141		Hull, J. E. (1955). British spiders: recent and amended records. Annals and Magazine of Natural History (12) 8: 49-56.
