2740	C F Roewer	Einige Araneen von Prof. Dr. Sixten Bocks Pacifik-Expedition 1917-1918	Meddelanden från Göteborgs Musei Zoologiska Avdelning			104		1	10	1944					http://www.wsc.nmbe.ch/reference/2740		Roewer, C. F. (1944). Einige Araneen von Prof. Dr. Sixten Bocks Pacifik-Expedition 1917-1918. Meddelanden från Göteborgs Musei Zoologiska Avdelning 104: 1-10.
2742	E Schenkel	Arachnoidea aus Timor und China aus den Sammlungen des Basler Museums	Revue Suisse de Zoologie			51		173	206	1944					http://www.wsc.nmbe.ch/reference/2742		Schenkel, E. (1944). Arachnoidea aus Timor und China aus den Sammlungen des Basler Museums. Revue Suisse de Zoologie 51: 173-206.
2743	V Šilhavý	De Araneis familiae Thomisidae in Balcano occidentali viventibus	Sborník Klubu Přírodovědeckého v Brně			25		90	95	1944					http://www.wsc.nmbe.ch/reference/2743		Šilhavý, V. (1944). De Araneis familiae Thomisidae in Balcano occidentali viventibus. Sborník Klubu Přírodovědeckého v Brně 25: 90-95.
2744	R H N Smithers	Contributions to our knowledge of the genus Latrodectus (Araneae) in South Africa	Annals of the South African Museum			36		263	312	1944					http://www.wsc.nmbe.ch/reference/2744		Smithers, R. H. N. (1944). Contributions to our knowledge of the genus Latrodectus (Araneae) in South Africa. Annals of the South African Museum 36: 263-312.
2745	B A M Soares	Aracnideos de Monte Alegre	Papéis Avulsos do Departamento de Zoologia, Secretaria de Agricultura, Sao Paolo			4		151	168	1944					http://www.wsc.nmbe.ch/reference/2745		Soares, B. A. M. (1944a). Aracnideos de Monte Alegre. Papéis Avulsos do Departamento de Zoologia, Secretaria de Agricultura, Sao Paolo 4: 151-168.
2746	B A M Soares	Notas sôbre aranhas. I	Papéis Avulsos do Departamento de Zoologia, Secretaria de Agricultura, Sao Paolo			4		319	320	1944					http://www.wsc.nmbe.ch/reference/2746		Soares, B. A. M. (1944b). Notas sôbre aranhas. I. Papéis Avulsos do Departamento de Zoologia, Secretaria de Agricultura, Sao Paolo 4: 319-320.
2747	B A M Soares	Quarto novos tomisidas neótropicos (Araneae-Thomisidae)	Boletim de Indústria Animal Sao Paulo (N.S.)			7		73	80	1944					http://www.wsc.nmbe.ch/reference/2747		Soares, B. A. M. (1944c). Quarto novos tomisidas neótropicos (Araneae-Thomisidae). Boletim de Indústria Animal Sao Paulo (N.S.) 7: 73-80.
2748	A Tullgren	Svensk Spindelfauna. 3. Araneae (Salticidae, Thomisidae, Philodromidae och Eusparassidae)								1944		Stockholm	pp		http://www.wsc.nmbe.ch/reference/2748		Tullgren, A. (1944). Svensk Spindelfauna. 3. Araneae (Salticidae, Thomisidae, Philodromidae och Eusparassidae). Stockholm, pp. 1-108.
2749	T Vogelsanger	Beitrag zur Kenntnis der schweizerischen Spinnenfauna	Mitteilungen der Naturforschenden Gesellschaft Schaffhausen			19		158	190	1944					http://www.wsc.nmbe.ch/reference/2749		Vogelsanger, T. (1944). Beitrag zur Kenntnis der schweizerischen Spinnenfauna. Mitteilungen der Naturforschenden Gesellschaft Schaffhausen 19: 158-190.
2750	W M Barrows	New spiders from the Great Smoky Mountain National Park	Annals of the Entomological Society of America			38		70	76	1945				10.1093/aesa/38.1.70	http://www.wsc.nmbe.ch/reference/2750		Barrows, W. M. (1945). New spiders from the Great Smoky Mountain National Park. Annals of the Entomological Society of America 38: 70-76.
2751	L Berland	Remarques sur des araignées capturées par des hyménoptères prédateurs aux îles Marquises	Bulletin de la Société Entomologique de France			50		23	26	1945					http://www.wsc.nmbe.ch/reference/2751		Berland, L. (1945). Remarques sur des araignées capturées par des hyménoptères prédateurs aux îles Marquises. Bulletin de la Société Entomologique de France 50: 23-26.
2752	W S Bristowe	A foreign spider, Argyope bruennichi Scop., established in England	Annals and Magazine of Natural History (11)			11		829	834	1945					http://www.wsc.nmbe.ch/reference/2752		Bristowe, W. S. (1945). A foreign spider, Argyope bruennichi Scop., established in England. Annals and Magazine of Natural History (11) 11: 829-834.
2753	E B Bryant	The Argiopidae of Hispaniola	Bulletin of the Museum of Comparative Zoology at Harvard College			95		357	422	1945					http://www.wsc.nmbe.ch/reference/2753		Bryant, E. B. (1945a). The Argiopidae of Hispaniola. Bulletin of the Museum of Comparative Zoology at Harvard College 95: 357-422.
2754	E B Bryant	Some new or little known southern spiders	Psyche, Cambridge			52		178	192	1945					http://www.wsc.nmbe.ch/reference/2754		Bryant, E. B. (1945b). Some new or little known southern spiders. Psyche, Cambridge 52: 178-192.
2755	E B Bryant	Notes on some Florida spiders	Transactions of the Connecticut Academy of Arts and Sciences			36		199	213	1945					http://www.wsc.nmbe.ch/reference/2755		Bryant, E. B. (1945c). Notes on some Florida spiders. Transactions of the Connecticut Academy of Arts and Sciences 36: 199-213.
2756	R V Chamberlin;W Ivie	On some Nearctic mygalomorph spiders	Annals of the Entomological Society of America			38		549	558	1945				10.1093/aesa/38.4.549	http://www.wsc.nmbe.ch/reference/2756		Chamberlin, R. V. & Ivie, W. (1945a). On some Nearctic mygalomorph spiders. Annals of the Entomological Society of America 38: 549-558.
2757	R V Chamberlin;W Ivie	Some erigonid spiders of the genera Eulaira and Diplocentria	Bulletin of the University of Utah			36	2	1	19	1945					http://www.wsc.nmbe.ch/reference/2757		Chamberlin, R. V. & Ivie, W. (1945b). Some erigonid spiders of the genera Eulaira and Diplocentria. Bulletin of the University of Utah 36(2): 1-19.
2758	R V Chamberlin;W Ivie	Erigonid spiders of the genera Spirembolus, Disembolus, and Bactroceps	Transactions of the Connecticut Academy of Arts and Sciences			36		216	235	1945					http://www.wsc.nmbe.ch/reference/2758		Chamberlin, R. V. & Ivie, W. (1945c). Erigonid spiders of the genera Spirembolus, Disembolus, and Bactroceps. Transactions of the Connecticut Academy of Arts and Sciences 36: 216-235.
2759	A M Chickering	Hypotypes of Accola spinosa Petrunkevitch (Dipluridae) from Panama	Transactions of the Connecticut Academy of Arts and Sciences			36		159	167	1945					http://www.wsc.nmbe.ch/reference/2759		Chickering, A. M. (1945). Hypotypes of Accola spinosa Petrunkevitch (Dipluridae) from Panama. Transactions of the Connecticut Academy of Arts and Sciences 36: 159-167.
2760	J Crane	Spiders of the family Salticidae from British Guiana and Venezuela	Zoologica (New York)			30		33	42	1945					http://www.wsc.nmbe.ch/reference/2760		Crane, J. (1945). Spiders of the family Salticidae from British Guiana and Venezuela. Zoologica (New York) 30: 33-42.
2723	J Denis	Notes sur les érigonides. IV. Sur les genres Enidia Smith et Dismodicus Simon (Arachnida)	Revue Française d'Entomologie 11(1944): 21-29. N.B.: year corrected from 1944 to 1945 by Canard &amp; Cruveillier,			2016		43		1945					http://www.wsc.nmbe.ch/reference/2723		Denis, J. (1945d). Notes sur les érigonides. IV. Sur les genres Enidia Smith et Dismodicus Simon (Arachnida). Revue Française d'Entomologie 11(1944): 21-29. N.B.: year corrected from 1944 to 1945 by Canard &amp; Cruveillier, 2016: 43.
2725	J Denis	Sur quelques Theridion appartenant à la faune de France	Bulletin de la Société Entomologique de France 49(1944): 111-117. N.B.: year corrected from 1944 to 1945 by Canard &amp; Cruveillier,			2016		43		1945					http://www.wsc.nmbe.ch/reference/2725		Denis, J. (1945a). Sur quelques Theridion appartenant à la faune de France. Bulletin de la Société Entomologique de France 49(1944): 111-117. N.B.: year corrected from 1944 to 1945 by Canard &amp; Cruveillier, 2016: 43
2761	J Denis	Notes sur les érigonides. VIII. Remarques synonymiques sur les genres Nematogmus et Cnephalocotes, Peponocranium et Hybocoptus	Bulletin de la Société Entomologique de France			50		35	37	1945					http://www.wsc.nmbe.ch/reference/2761		Denis, J. (1945e). Notes sur les érigonides. VIII. Remarques synonymiques sur les genres Nematogmus et Cnephalocotes, Peponocranium et Hybocoptus. Bulletin de la Société Entomologique de France 50: 35-37.
2762	J Denis	Descriptions d'araignées nord-africaines	Bulletin de la Société d'Histoire Naturelle de Toulouse			79		41	57	1945					http://www.wsc.nmbe.ch/reference/2762		Denis, J. (1945b). Descriptions d'araignées nord-africaines. Bulletin de la Société d'Histoire Naturelle de Toulouse 79: 41-57.
2763	J Denis	Notes sur les érigonides. X. Remarques sur le genre Entelecara E. Simon avec la description de formes nouvelles du genre Plaesiocraerus E. Simon	Bulletin de la Société d'Histoire Naturelle de Toulouse			80		203	215	1945					http://www.wsc.nmbe.ch/reference/2763		Denis, J. (1945c). Notes sur les érigonides. X. Remarques sur le genre Entelecara E. Simon avec la description de formes nouvelles du genre Plaesiocraerus E. Simon. Bulletin de la Société d'Histoire Naturelle de Toulouse 80: 203-215.
2764	H Exline	Spiders of the genus Conopistha (Theridiidae, Conopisthinae) from northwestern Peru and Ecuador	Annals of the Entomological Society of America			38		505	528	1945				10.1093/aesa/38.4.505	http://www.wsc.nmbe.ch/reference/2764		Exline, H. (1945a). Spiders of the genus Conopistha (Theridiidae, Conopisthinae) from northwestern Peru and Ecuador. Annals of the Entomological Society of America 38: 505-528.
2765	H Exline	A new group of the genus Conopistha Karsch, 1881 (Theridiidae, Conopisthinae) and three new species from Ecuador and Peru	Transactions of the Connecticut Academy of Arts and Sciences			36		177	189	1945					http://www.wsc.nmbe.ch/reference/2765		Exline, H. (1945b). A new group of the genus Conopistha Karsch, 1881 (Theridiidae, Conopisthinae) and three new species from Ecuador and Peru. Transactions of the Connecticut Academy of Arts and Sciences 36: 177-189.
2766	L Fage	A propos de quelques araignées cavernicoles de Crète	Bulletin du Muséum National d'Histoire Naturelle de Paris (2)			17		109	114	1945					http://www.wsc.nmbe.ch/reference/2766		Fage, L. (1945a). A propos de quelques araignées cavernicoles de Crète. Bulletin du Muséum National d'Histoire Naturelle de Paris (2) 17: 109-114.
2767	L Fage	Arachnides cavernicoles nouveaux de Madagascar	Bulletin du Muséum National d'Histoire Naturelle de Paris (2)			17		301	307	1945					http://www.wsc.nmbe.ch/reference/2767		Fage, L. (1945b). Arachnides cavernicoles nouveaux de Madagascar. Bulletin du Muséum National d'Histoire Naturelle de Paris (2) 17: 301-307.
2768	W J Gertsch	Two interesting species of Thallumetus	Transactions of the Connecticut Academy of Arts and Sciences			36		191	197	1945					http://www.wsc.nmbe.ch/reference/2768		Gertsch, W. J. (1945). Two interesting species of Thallumetus. Transactions of the Connecticut Academy of Arts and Sciences 36: 191-197.
2769	V V Hickman	A new group of apneumone spiders	Transactions of the Connecticut Academy of Arts and Sciences			36		135	157	1945					http://www.wsc.nmbe.ch/reference/2769		Hickman, V. V. (1945). A new group of apneumone spiders. Transactions of the Connecticut Academy of Arts and Sciences 36: 135-157.
2770	Å Holm	Ein Beitrag zur Salticiden-Fauna Schwedens	Arkiv för Zoologi			35	B4	1	4	1945					http://www.wsc.nmbe.ch/reference/2770		Holm, Å. (1945a). Ein Beitrag zur Salticiden-Fauna Schwedens. Arkiv för Zoologi 35(B4): 1-4.
2771	Å Holm	Zur Kenntnis der Spinnenfauna des Torneträskgebietes	Arkiv för Zoologi			36	A 15	1	80	1945					http://www.wsc.nmbe.ch/reference/2771		Holm, Å. (1945b). Zur Kenntnis der Spinnenfauna des Torneträskgebietes. Arkiv för Zoologi 36(A 15): 1-80.
2772	S E Jones	A new southern spider	Field and Laboratory (Dallas)			13		39	41	1945					http://www.wsc.nmbe.ch/reference/2772		Jones, S. E. (1945). A new southern spider. Field and Laboratory (Dallas) 13: 39-41.
2773	B J Kaston	New spiders in the group Dionycha with notes on other species	American Museum Novitates			1290		1	25	1945					http://www.wsc.nmbe.ch/reference/2773		Kaston, B. J. (1945a). New spiders in the group Dionycha with notes on other species. American Museum Novitates 1290: 1-25, f. 1-85.
2774	B J Kaston	New Micryphantidae and Dictynidae with notes on other spiders	American Museum Novitates			1292		1	14	1945					http://www.wsc.nmbe.ch/reference/2774		Kaston, B. J. (1945b). New Micryphantidae and Dictynidae with notes on other spiders. American Museum Novitates 1292: 1-14.
2775															http://www.wsc.nmbe.ch/reference/2775		Lohmander, H. (1945). Arachnologische Fragmente 3. Die Salticiden-Gattung Neon Simon in Südschweden. Göteborgs Kungliga Vetenskaps och Vitterhets Samhälles Handlingar (6) 3B(9): 31-75.
2775															http://www.wsc.nmbe.ch/reference/2775		Lohmander, H. (1945). Arachnologische Fragmente 3. Die Salticiden-Gattung Neon Simon in Südschweden. Göteborgs Kungliga Vetenskaps och Vitterhets Samhälles Handlingar (6) 3B(9): 31-75.
2776	C F De Mello-Leitão	Tres novas especies de Gasteracanthinae e notas sôbre a subfamília	Anais da Academia Brasileira de Ciências			17		261	267	1945					http://www.wsc.nmbe.ch/reference/2776		Mello-Leitão, C. F. de (1945a). Tres novas especies de Gasteracanthinae e notas sôbre a subfamília. Anais da Academia Brasileira de Ciências 17: 261-267.
2777	C F De Mello-Leitão	Arañas de Misiones, Corrientes y Entre Ríos	Revista del Museo de La Plata (N.S., Zool.)			4		213	302	1945					http://www.wsc.nmbe.ch/reference/2777		Mello-Leitão, C. F. de (1945b). Arañas de Misiones, Corrientes y Entre Ríos. Revista del Museo de La Plata (N.S., Zool.) 4: 213-302.
2778	C F De Mello-Leitão	Some interesting new Brazilian spiders	Transactions of the Connecticut Academy of Arts and Sciences			36		169	175	1945					http://www.wsc.nmbe.ch/reference/2778		Mello-Leitão, C. F. de (1945c). Some interesting new Brazilian spiders. Transactions of the Connecticut Academy of Arts and Sciences 36: 169-175.
2779	M H Muma	New and interesting spiders from Maryland	Proceedings of the Biological Society of Washington			58		91	104	1945					http://www.wsc.nmbe.ch/reference/2779		Muma, M. H. (1945). New and interesting spiders from Maryland. Proceedings of the Biological Society of Washington 58: 91-104.
2780	R D Schiapelli;B S Gerschman	Parte descriptiva. In: Vellard, J., R. D. Schiapelli & B. S. Gerschman (eds.) Arañas sudamericanas colleccionadas por el Doctor J. Vellard. I. Theraphosidae nuevas o poco conocidas	Acta Zoologica Lilloana			3		165	213	1945					http://www.wsc.nmbe.ch/reference/2780		Schiapelli, R. D. & Gerschman, B. S. (1945). Parte descriptiva. In: Vellard, J., R. D. Schiapelli & B. S. Gerschman (eds.) Arañas sudamericanas colleccionadas por el Doctor J. Vellard. I. Theraphosidae nuevas o poco conocidas. Acta Zoologica Lilloana 3, 165-213.
2781	R H N Smithers	The Hersiliidae (Araneae) of South Africa	Transactions of the Royal Society of South Africa			31		1	18	1945				10.1080/00359194509520547	http://www.wsc.nmbe.ch/reference/2781		Smithers, R. H. N. (1945). The Hersiliidae (Araneae) of South Africa. Transactions of the Royal Society of South Africa 31: 1-18.
2782	V Todd	Systematic and biological account of the New Zealand Mygalomorphae (Arachnida)	Transactions and Proceedings of the Royal Society of New Zealand			74		375	407	1945					http://www.wsc.nmbe.ch/reference/2782		Todd, V. (1945). Systematic and biological account of the New Zealand Mygalomorphae (Arachnida). Transactions and Proceedings of the Royal Society of New Zealand 74: 375-407.
2783	A F Archer	The Theridiidae or comb-footed spiders of Alabama	Museum Paper, Alabama Museum of Natural History			22		1	67	1946					http://www.wsc.nmbe.ch/reference/2783		Archer, A. F. (1946). The Theridiidae or comb-footed spiders of Alabama. Museum Paper, Alabama Museum of Natural History 22: 1-67.
2784	M Birabén	Nueva Mastophora de Tucumán (Arachn. Argiop.)	Acta Zoologica Lilloana			3		327	330	1946					http://www.wsc.nmbe.ch/reference/2784		Birabén, M. (1946). Nueva Mastophora de Tucumán (Arachn. Argiop.). Acta Zoologica Lilloana 3: 327-330.
2785	S Bishop;C Ruderman	Four new species of Dictyna	Proceedings of the Biological Society of Washington			59		1	8	1946					http://www.wsc.nmbe.ch/reference/2785		Bishop, S. & Ruderman, C. (1946). Four new species of Dictyna. Proceedings of the Biological Society of Washington 59: 1-8.
2786	J Braendegaard	The spiders (Araneina) of East Greenland: A faunistic and zoogeographical investigation	Meddelelser om Gr&oslash;nland			121	15	1	128	1946					http://www.wsc.nmbe.ch/reference/2786		Braendegaard, J. (1946). The spiders (Araneina) of East Greenland: A faunistic and zoogeographical investigation. Meddelelser om Gr&oslash;nland 121(15): 1-128.
2787	E B Bryant	The genotype of Mimetus Hentz	Psyche, Cambridge			53		48		1946					http://www.wsc.nmbe.ch/reference/2787		Bryant, E. B. (1946). The genotype of Mimetus Hentz. Psyche, Cambridge 53: 48.
2788	G Chamberlain	Revision of the Araneae of New Zealand. Part II	Records of the Auckland Institute and Museum			3		85	97	1946					http://www.wsc.nmbe.ch/reference/2788		Chamberlain, G. (1946). Revision of the Araneae of New Zealand. Part II. Records of the Auckland Institute and Museum 3: 85-97.
2789	R V Chamberlin;W Ivie	On several new American spiders	Bulletin of the University of Utah			36	13	1	15	1946					http://www.wsc.nmbe.ch/reference/2789		Chamberlin, R. V. & Ivie, W. (1946). On several new American spiders. Bulletin of the University of Utah 36(13): 1-15.
2790	D E Charitonov	New forms of spiders of the USSR. Izvestija Estedvenno-Nauchnogo Instituta pri Molotovskom Gosudarstvennom Universitete imeni M	Gor'kogo			12		19	32	1946					http://www.wsc.nmbe.ch/reference/2790		Charitonov, D. E. (1946). New forms of spiders of the USSR. Izvestija Estedvenno-Nauchnogo Instituta pri Molotovskom Gosudarstvennom Universitete imeni M. Gor'kogo 12: 19-32.
2791	A M Chickering	The Salticidae of Panama	Bulletin of the Museum of Comparative Zoology at Harvard College			97		1	474	1946					http://www.wsc.nmbe.ch/reference/2791		Chickering, A. M. (1946). The Salticidae of Panama. Bulletin of the Museum of Comparative Zoology at Harvard College 97: 1-474.
2792	J Denis	Notes sur les érigonides. IX. La femelle de Cnephalocotes obscurus (Blackwall)	Bulletin de la Société Entomologique de France			51		11	12	1946					http://www.wsc.nmbe.ch/reference/2792		Denis, J. (1946a). Notes sur les érigonides. IX. La femelle de Cnephalocotes obscurus (Blackwall). Bulletin de la Société Entomologique de France 51: 11-12.
2793	J Denis	Sur quelques araignées capturées récemment en France	Revue Française d'Entomologie			13		36	44	1946					http://www.wsc.nmbe.ch/reference/2793		Denis, J. (1946b). Sur quelques araignées capturées récemment en France. Revue Française d'Entomologie 13: 36-44.
2794	J Denis;E Dresco	Une araignée nouvelle pour la faune de France	Bulletin de la Société Entomologique de France			51		103	106	1946					http://www.wsc.nmbe.ch/reference/2794		Denis, J. & Dresco, E. (1946). Une araignée nouvelle pour la faune de France. Bulletin de la Société Entomologique de France 51: 103-106.
2795	A P Dunn;R A Dunn	Studies in Australian spiders	The Victorian Naturalist			63		87	93	1946					http://www.wsc.nmbe.ch/reference/2795		Dunn, A. P. & Dunn, R. A. (1946). Studies in Australian spiders. The Victorian Naturalist 63: 87-93.
2796	L Fage	Araignées cavernicoles de l'Inde	Bulletin du Muséum National d'Histoire Naturelle de Paris (2)			18		382	388	1946					http://www.wsc.nmbe.ch/reference/2796		Fage, L. (1946). Araignées cavernicoles de l'Inde. Bulletin du Muséum National d'Histoire Naturelle de Paris (2) 18: 382-388.
2797	P Franganillo B	Arañas nuevas	Memorias de la Sociedad Cubana de Historia Natural "Felipe Poey"			18		97	102	1946					http://www.wsc.nmbe.ch/reference/2797		Franganillo B., P. (1946). Arañas nuevas. Memorias de la Sociedad Cubana de Historia Natural "Felipe Poey" 18: 97-102.
2798	W J Gertsch	Notes on American spiders of the family Dictynidae	American Museum Novitates			1319		1	21	1946					http://www.wsc.nmbe.ch/reference/2798		Gertsch, W. J. (1946a). Notes on American spiders of the family Dictynidae. American Museum Novitates 1319: 1-21.
2799	W J Gertsch	Five new spiders of the genus Neoantistea	Journal of The New York Entomological Society			54		31	36	1946					http://www.wsc.nmbe.ch/reference/2799		Gertsch, W. J. (1946b). Five new spiders of the genus Neoantistea. Journal of The New York Entomological Society 54: 31-36.
2800	W J Gertsch;L I Davis	Report on a collection of spiders from Mexico. V	American Museum Novitates			1313		1	11	1946					http://www.wsc.nmbe.ch/reference/2800		Gertsch, W. J. & Davis, L. I. (1946). Report on a collection of spiders from Mexico. V. American Museum Novitates 1313: 1-11.
2801	A Ibarra G	Arañas y araneismo (Las arañas peligrosas en la República Argentina)	La Semana Médica, Buenos Aires			50		763	793	1946					http://www.wsc.nmbe.ch/reference/2801		Ibarra G., A. (1946). Arañas y araneismo (Las arañas peligrosas en la República Argentina). La Semana Médica, Buenos Aires 50: 763-793.
2802	S E Jones	Description of Habrocestum parvulum (Banks)	Psyche, Cambridge			53		27	29	1946					http://www.wsc.nmbe.ch/reference/2802		Jones, S. E. (1946). Description of Habrocestum parvulum (Banks). Psyche, Cambridge 53: 27-29.
2803	B J Kaston	North American spiders of the genus Ctenium	American Museum Novitates			1306		1	19	1946					http://www.wsc.nmbe.ch/reference/2803		Kaston, B. J. (1946). North American spiders of the genus Ctenium. American Museum Novitates 1306: 1-19.
2804	A A D La Touche	Hampshire spiders, including the description of a new species, Diplocephalus cottoni	Proceedings of the Zoological Society of London			115		281	295	1946				10.1111/j.1096-3642.1946.tb00091.x	http://www.wsc.nmbe.ch/reference/2804		La Touche, A. A. D. (1946). Hampshire spiders, including the description of a new species, Diplocephalus cottoni. Proceedings of the Zoological Society of London 115: 281-295.
2805	R Laurent	Notes arachnologiques africaines II.-Sur quelques théraphosides du Congo Belge (Ischnocolinae, Eumenophorinae, Selenocosmiinae)	Revue de Zoologie et de Botanique Africaines			39		293	326	1946					http://www.wsc.nmbe.ch/reference/2805		Laurent, R. (1946). Notes arachnologiques africaines II.-Sur quelques théraphosides du Congo Belge (Ischnocolinae, Eumenophorinae, Selenocosmiinae). Revue de Zoologie et de Botanique Africaines 39: 293-326.
2806	R Lessert	Araignées du Congo Belge	Revue Suisse de Zoologie			58		204	225	1946					http://www.wsc.nmbe.ch/reference/2806		Lessert, R. (1946). Araignées du Congo Belge. Revue Suisse de Zoologie 58: 204-225.
2807	T Mcheidze	Nov'e vid' paukov v Gruzii	Bulletin du Muséum de Géorgie			13	A	285	302	1946					http://www.wsc.nmbe.ch/reference/2807		Mcheidze, T. (1946). Nov'e vid' paukov v Gruzii. Bulletin du Muséum de Géorgie 13(A): 285-302.
2808	C F De Mello-Leitão	Notas sobre os Filistatidae e Pholcidae	Anais da Academia Brasileira de Ciências			18		39	83	1946					http://www.wsc.nmbe.ch/reference/2808		Mello-Leitão, C. F. de (1946a). Notas sobre os Filistatidae e Pholcidae. Anais da Academia Brasileira de Ciências 18: 39-83.
2809	C F De Mello-Leitão	Arañas del Paraguay	Notas del Museo de la Plata			11	Zool. 91	17	50	1946					http://www.wsc.nmbe.ch/reference/2809		Mello-Leitão, C. F. de (1946b). Arañas del Paraguay. Notas del Museo de la Plata 11(Zool. 91): 17-50.
2810	C F De Mello-Leitão	Nuevos aracnidos sudamericanos de las colecciones del Museo de Historia Natural de Montevideo	Comunicaciones Zoologicas del Museo de Historia Natural de Montevideo			2	35	1	10	1946					http://www.wsc.nmbe.ch/reference/2810		Mello-Leitão, C. F. de (1946c). Nuevos aracnidos sudamericanos de las colecciones del Museo de Historia Natural de Montevideo. Comunicaciones Zoologicas del Museo de Historia Natural de Montevideo 2(35): 1-10.
2811	J Millot	Les pholcides de Madagascar (Aranéides)	Mémoires du Muséum National d'Histoire Naturelle de Paris (N.S.)			22		127	158	1946					http://www.wsc.nmbe.ch/reference/2811		Millot, J. (1946a). Les pholcides de Madagascar (Aranéides). Mémoires du Muséum National d'Histoire Naturelle de Paris (N.S.) 22: 127-158.
2812	J Millot	Les Scytodes d'Afrique Noire française (Araneae)	Revue Française d'Entomologie			13		156	168	1946					http://www.wsc.nmbe.ch/reference/2812		Millot, J. (1946b). Les Scytodes d'Afrique Noire française (Araneae). Revue Française d'Entomologie 13: 156-168.
2813	M H Muma	North American Agelenidae of the genus Coras Simon	American Museum Novitates			1329		1	20	1946					http://www.wsc.nmbe.ch/reference/2813		Muma, M. H. (1946). North American Agelenidae of the genus Coras Simon. American Museum Novitates 1329: 1-20.
2814	A W Parrott	A systematic catalogue of New Zealand spiders	Records of the Canterbury Museum			5		51	93	1946					http://www.wsc.nmbe.ch/reference/2814		Parrott, A. W. (1946). A systematic catalogue of New Zealand spiders. Records of the Canterbury Museum 5: 51-93.
2815	B A M Soares;H E M Soares	Contribuição ao estudo das aranhas do estado do Espírito Santo	Papéis Avulsos do Departamento de Zoologia, Secretaria de Agricultura, Sao Paolo			7		51	72	1946					http://www.wsc.nmbe.ch/reference/2815		Soares, B. A. M. & Soares, H. E. M. (1946). Contribuição ao estudo das aranhas do estado do Espírito Santo. Papéis Avulsos do Departamento de Zoologia, Secretaria de Agricultura, Sao Paolo 7: 51-72.
2816	H E M Soares	Um novo tomisida brasilieros	Papéis Avulsos do Departamento de Zoologia, Secretaria de Agricultura, Sao Paolo			7		267	269	1946					http://www.wsc.nmbe.ch/reference/2816		Soares, H. E. M. (1946). Um novo tomisida brasilieros. Papéis Avulsos do Departamento de Zoologia, Secretaria de Agricultura, Sao Paolo 7: 267-269.
