12469	H M Smith	The spider genus Toxopsoides (Araneae: Desidae: Toxopinae): new records and species from Australia	Proceedings of the Linnean Society of New South Wales			135		19	43	2013					http://www.wsc.nmbe.ch/reference/12469		Smith, H. M. (2013). The spider genus Toxopsoides (Araneae: Desidae: Toxopinae): new records and species from Australia. Proceedings of the Linnean Society of New South Wales 135: 19-43.
12470	C Srinivasulu;B Srinivasulu;S M M Javed;M Seetharamaraju;S A Jyothi;C A Srinivasulu;F Tampal	Additions to the araneofauna of Andhra Pradesh, India - Part II. Records of interesting species of the comb-footed genera Latrodectus, Rhomphaea and Coleosoma (Araneae: Theridiidae)	Journal of Threatened Taxa			5		4483	4491	2013				10.11609/jott.o2660.4483-91	http://www.wsc.nmbe.ch/reference/12470		Srinivasulu, C., Srinivasulu, B., Javed, S. M. M., Seetharamaraju, M., Jyothi, S. A., Srinivasulu, C. A. & Tampal, F. (2013). Additions to the araneofauna of Andhra Pradesh, India - Part II. Records of interesting species of the comb-footed genera Latrodectus, Rhomphaea and Coleosoma (Araneae: Theridiidae). Journal of Threatened Taxa 5: 4483-4491.
12471	T Suguro	The first record of Cosmophasis lami (Araneae: Salticidae) from Japan	Acta Arachnologica			62		19	22	2013				10.2476/asjaa.62.19	http://www.wsc.nmbe.ch/reference/12471		Suguro, T. (2013a). The first record of Cosmophasis lami (Araneae: Salticidae) from Japan. Acta Arachnologica 62: 19-22.
12771	T Suguro	[About Bianor incitatus, occurring on Ryukyu Is.]	Kishidaia			102		5	8	2013					http://www.wsc.nmbe.ch/reference/12771		Suguro, T. (2013b). [About Bianor incitatus, occurring on Ryukyu Is.]. Kishidaia 102: 5-8.
12772	T Suguro	[The first collecting data of male of Pisaura bicornis from Japan]	Kishidaia			102		14	15	2013					http://www.wsc.nmbe.ch/reference/12772		Suguro, T. (2013c). [The first collecting data of male of Pisaura bicornis from Japan]. Kishidaia 102: 14-15.
13184	J K Sunil	New species of Yaginumaella Proszynski from India (Araneae: Salticidae)	Munis Entomology and Zoology			8	1	63	66	2013					http://www.wsc.nmbe.ch/reference/13184		Sunil, J. K. (2013). New species of Yaginumaella Proszynski from India (Araneae: Salticidae). Munis Entomology and Zoology 8(1): 63-66.
12974	S Talukdar;A K Sanyal	First record of the genus Nesticodes Simon, 1894 [sic!] from India with taxonomic studies on a red cob-web-spider Nesticodes rufipes (Lucas, 1846) (Araneae: Theridiidae) from West Bengal, India	Records of the Zoological Survey of India			113	3	41	47	2013					http://www.wsc.nmbe.ch/reference/12974		Talukdar, S. & Sanyal, A. K. (2013). First record of the genus Nesticodes Simon, 1894 [sic!] from India with taxonomic studies on a red cob-web-spider Nesticodes rufipes (Lucas, 1846) (Araneae: Theridiidae) from West Bengal, India. Records of the Zoological Survey of India 113(3): 41-47.
12283	A V Tanasevitch	On linyphiid spiders (Araneae) from Israel	Revue Suisse de Zoologie			120		101	124	2013					http://www.wsc.nmbe.ch/reference/12283		Tanasevitch, A. V. (2013a). On linyphiid spiders (Araneae) from Israel. Revue Suisse de Zoologie 120: 101-124.
12284	A V Tanasevitch	On synonymy of linyphiid spiders of the Russian fauna. 3 (Arachnida: Aranei: Linyphiidae)	Arthropoda Selecta			22		171	187	2013					http://www.wsc.nmbe.ch/reference/12284		Tanasevitch, A. V. (2013b). On synonymy of linyphiid spiders of the Russian fauna. 3 (Arachnida: Aranei: Linyphiidae). Arthropoda Selecta 22: 171-187.
12472	A V Tanasevitch	The linyphiid spiders of the Altais, southern Siberia (Aranei: Linyphiidae)	Arthropoda Selecta			22		267	306	2013					http://www.wsc.nmbe.ch/reference/12472		Tanasevitch, A. V. (2013c). The linyphiid spiders of the Altais, southern Siberia (Aranei: Linyphiidae). Arthropoda Selecta 22: 267-306.
12473	A V Tanasevitch;S L Esyunin	A new Centromerus Dahl, 1886 from the Kirov area, Russia (Aranei: Linyphiidae)	Arthropoda Selecta			22		357	360	2013					http://www.wsc.nmbe.ch/reference/12473		Tanasevitch, A. V. & Esyunin, S. L. (2013). A new Centromerus Dahl, 1886 from the Kirov area, Russia (Aranei: Linyphiidae). Arthropoda Selecta 22: 357-360.
12474	G Tang;W F Luo;S Y Deng	First description of the female Ozyptila kansuensis (Tang, Song & Zhu, 1995), comb. nov. (Araneae: Thomisidae)	Zootaxa			3737		97	100	2013					http://www.wsc.nmbe.ch/reference/12474		Tang, G., Luo, W. F. & Deng, S. Y. (2013). First description of the female Ozyptila kansuensis (Tang, Song &amp; Zhu, 1995), comb. nov. (Araneae: Thomisidae). Zootaxa 3737: 97-100.
12475	A Tanikawa	Taxonomic revision of the spider genus Ryuthela (Araneae: Liphistiidae)	Acta Arachnologica			62		33	40	2013				10.2476/asjaa.62.33	http://www.wsc.nmbe.ch/reference/12475		Tanikawa, A. (2013a). Taxonomic revision of the spider genus Ryuthela (Araneae: Liphistiidae). Acta Arachnologica 62: 33-40.
12539	A Tanikawa	Two new species of the genus Cyrtarachne (Araneae: Araneidae) from Japan hitherto identified as C. inaequalis	Acta Arachnologica			62	2	95	101	2013				10.2476/asjaa.62.95	http://www.wsc.nmbe.ch/reference/12539		Tanikawa, A. (2013b). Two new species of the genus Cyrtarachne (Araneae: Araneidae) from Japan hitherto identified as C. inaequalis. Acta Arachnologica 62(2): 95-101.
12541	A Tanikawa;A Yawata	A new species of the genus Nesticus (Araneae: Nestcidae) from Miyagi Prefecture, Japan	Acta Arachnologica			62	2	109	110	2013				10.2476/asjaa.62.109	http://www.wsc.nmbe.ch/reference/12541		Tanikawa, A. & Yawata, A. (2013). A new species of the genus Nesticus (Araneae: Nestcidae) from Miyagi Prefecture, Japan. Acta Arachnologica 62(2): 109-110. Link
12285	A O Taucare-Ríos	El género de arañas Scytodes Latreille, 1804 (Araneae: Scytodidae) en Chile: diversidad y distribución	Revista Chilena de Historia Natural			86		103	105	2013				10.4067/s0716-078x2013000100009	http://www.wsc.nmbe.ch/reference/12285		Taucare-Ríos, A. O. (2013). El género de arañas Scytodes Latreille, 1804 (Araneae: Scytodidae) en Chile: diversidad y distribución. Revista Chilena de Historia Natural 86: 103-105.
12286	Y F Tong;S Q Li	A new species of the genus Prethopalpus from Hainan Island, China (Araneae: Oonopidae)	Zootaxa			3620		596	600	2013					http://www.wsc.nmbe.ch/reference/12286		Tong, Y. F. & Li, S. Q. (2013a). A new species of the genus Prethopalpus from Hainan Island, China (Araneae: Oonopidae). Zootaxa 3620: 596-600.
12476	Y F Tong	Haplogynae Spiders from Hainan, China								2013		Ke xue chu ban she	Beijing, vi		http://www.wsc.nmbe.ch/reference/12476		Tong, Y. F. (2013). Haplogynae Spiders from Hainan, China. Ke xue chu ban she, Beijing, vi+96 pp., 81 pl.
12477	Y F Tong;S Q Li	Six new species of oonopid spiders from Champasak, Laos (Araneae, Oonopidae)	Zootaxa			3709		71	88	2013					http://www.wsc.nmbe.ch/reference/12477		Tong, Y. F. & Li, S. Q. (2013b). Six new species of oonopid spiders from Champasak, Laos (Araneae, Oonopidae). Zootaxa 3709: 71-88.
12478	Y F Tong;S Q Li	The first goblin spiders of the genus Trilacuna from Vietnam (Araneae, Oonopidae)	Zootaxa			3709		277	284	2013					http://www.wsc.nmbe.ch/reference/12478		Tong, Y. F. & Li, S. Q. (2013c). The first goblin spiders of the genus Trilacuna from Vietnam (Araneae, Oonopidae). Zootaxa 3709: 277-284.
12479	Y F Tong;S Q Li	A new genus and species of oonopid spiders from Laos (Araneae, Oonopidae)	Acta Zootaxonomica Sinica			38		784	789	2013					http://www.wsc.nmbe.ch/reference/12479		Tong, Y. F. & Li, S. Q. (2013d). A new genus and species of oonopid spiders from Laos (Araneae, Oonopidae). Acta Zootaxonomica Sinica 38: 784-789.
12480	M A Townley;D Harms;S P Benjamin	Phylogenetic affinities of Phobetinus to other pirate spider genera (Araneae: Mimetidae) as indicated by spinning field morphology	Arthropod Structure & Development			42		407	423	2013				10.1016/j.asd.2013.04.003	http://www.wsc.nmbe.ch/reference/12480		Townley, M. A., Harms, D. & Benjamin, S. P. (2013). Phylogenetic affinities of Phobetinus to other pirate spider genera (Araneae: Mimetidae) as indicated by spinning field morphology. Arthropod Structure & Development 42: 407-423.
12287	A Valdez-Mondragón	Taxonomic revision of the spider genus Ixchela Huber, 2000 (Araneae: Pholcidae), with description of ten new species from Mexico and Central America	Zootaxa			3608		285	327	2013					http://www.wsc.nmbe.ch/reference/12287		Valdez-Mondragón, A. (2013a). Taxonomic revision of the spider genus Ixchela Huber, 2000 (Araneae: Pholcidae), with description of ten new species from Mexico and Central America. Zootaxa 3608: 285-327.
12481	A Valdez-Mondragón	Morphological phylogenetic analysis of the spider genus Physocyclus (Araneae: Pholcidae)	Journal of Arachnology			41		184	196	2013					http://www.wsc.nmbe.ch/reference/12481		Valdez-Mondragón, A. (2013b). Morphological phylogenetic analysis of the spider genus Physocyclus (Araneae: Pholcidae). Journal of Arachnology 41: 184-196.
12749	S J Valle;C Bingham Keiser;L S Vincent;R S Vetter	A South American spider, Falconina gracilis (Keyserling 1891) (Araneae: Corinnidae), newly established in southern California	The Pan-Pacific Entomologist			89	4	259	263	2013				10.3956/2013-23.1	http://www.wsc.nmbe.ch/reference/12749		Valle, S. J., Bingham Keiser, C., Vincent, L. S. & Vetter, R. S. (2013). A South American spider, Falconina gracilis (Keyserling 1891) (Araneae: Corinnidae), newly established in southern California. The Pan-Pacific Entomologist 89(4): 259-263. doi:10.3956/2013-23.1
12288	G Vankhede;S Keswani;A Rajoria	A new species of the spider genus Hygropoda (Araneae: Pisauridae) from India	Indian Journal of Arachnology			2	1	52	60	2013					http://www.wsc.nmbe.ch/reference/12288		Vankhede, G., Keswani, S. & Rajoria, A. (2013). A new species of the spider genus Hygropoda (Araneae: Pisauridae) from India. Indian Journal of Arachnology 2(1): 52-60.
12289	C J Vink;N Dupérré;J Malumbres-Olarte	Periegopidae (Arachnida: Araneae)	Fauna of New Zealand			70		1	35	2013					http://www.wsc.nmbe.ch/reference/12289		Vink, C. J., Dupérré, N. & Malumbres-Olarte, J. (2013). Periegopidae (Arachnida: Araneae). Fauna of New Zealand 70: 1-35.
12482	O Vöcking;G Uhl;P Michalik	Sperm dynamics in spiders (Araneae): ultrastructural analysis of the sperm activation process in the garden spider Argiope bruennichi (Scopoli, 1772)	PLoS One			8	9	e72660		2013				10.1371/journal.pone.0072660	http://www.wsc.nmbe.ch/reference/12482		Vöcking, O., Uhl, G. & Michalik, P. (2013). Sperm dynamics in spiders (Araneae): ultrastructural analysis of the sperm activation process in the garden spider Argiope bruennichi (Scopoli, 1772). PLoS One 8(9): e72660: 1-7. doi:10.1371/journal.pone.0072660
12290	B Vrenozi;J A Dunlop	Albanian arachnids in the Museum für Naturkunde, Berlin	Arachnology			16		10	15	2013				10.13156/arac.2013.16.1.10	http://www.wsc.nmbe.ch/reference/12290		Vrenozi, B. & Dunlop, J. A. (2013). Albanian arachnids in the Museum für Naturkunde, Berlin. Arachnology 16: 10-15.
12585	J M Waldock	A review of the peacock spiders of the Maratus mungaich species-group (Araneae: Salticidae), with descriptions of four new species	Records of the Western Australian Museum			28		66	81	2013				10.18195/issn.0312-3162.28(1).2013.066-081	http://www.wsc.nmbe.ch/reference/12585		Waldock, J. M. (2013). A review of the peacock spiders of the Maratus mungaich species-group (Araneae: Salticidae), with descriptions of four new species. Records of the Western Australian Museum 28: 66-81.
12483	J L Wan;X J Peng	The spiders of the genus Wolongia Zhu, Kim & Song, 1997 from China (Araneae: Tetragnathidae)	Zootaxa			3691		87	134	2013					http://www.wsc.nmbe.ch/reference/12483		Wan, J. L. & Peng, X. J. (2013a). The spiders of the genus Wolongia Zhu, Kim &amp; Song, 1997 from China (Araneae: Tetragnathidae). Zootaxa 3691: 87-134.
12484	J L Wan;X J Peng	Description of Leucauge tengchongensis sp. nov. and the female of Okileucauge elongatus from Yunnan, China (Araneae: Tetragnathidae)	Acta Arachnologica Sinica			22		16	23	2013					http://www.wsc.nmbe.ch/reference/12484		Wan, J. L. & Peng, X. J. (2013b). Description of Leucauge tengchongensis sp. nov. and the female of Okileucauge elongatus from Yunnan, China (Araneae: Tetragnathidae). Acta Arachnologica Sinica 22: 16-23.
12291	Y N Wang;F Zhang	A new spider species of the genus Cheiracanthium (Araneae, Miturgidae) from Guangxi, China	Acta Zootaxonomica Sinica			38		59	63	2013					http://www.wsc.nmbe.ch/reference/12291		Wang, Y. N. & Zhang, F. (2013). A new spider species of the genus Cheiracanthium (Araneae, Miturgidae) from Guangxi, China. Acta Zootaxonomica Sinica 38: 59-63.
12485	C X Wang;S Q Li	Four new species of the subfamily Psilodercinae (Araneae: Ochyroceratidae) from southwest China	Zootaxa			3718		39	57	2013					http://www.wsc.nmbe.ch/reference/12485		Wang, C. X. & Li, S. Q. (2013). Four new species of the subfamily Psilodercinae (Araneae: Ochyroceratidae) from southwest China. Zootaxa 3718: 39-57.
12292	W Wesołowska;C R Haddad	New data on the jumping spiders of South Africa (Araneae: Salticidae)	African Invertebrates			54		177	240	2013					http://www.wsc.nmbe.ch/reference/12292		Wesołowska, W. & Haddad, C. R. (2013). New data on the jumping spiders of South Africa (Araneae: Salticidae). African Invertebrates 54: 177-240.
12486	W Wesołowska;K Wiśniewski	New species of Phintella from West Africa (Araneae: Salticidae: Heliophaninae)	Genus			24		247	250	2013					http://www.wsc.nmbe.ch/reference/12486		Wesołowska, W. & Wiśniewski, K. (2013). New species of Phintella from West Africa (Araneae: Salticidae: Heliophaninae). Genus 24: 247-250.
12487	K Wiśniewski;W Wesołowska	New Thiratoscirtus species from equatorial Africa (Araneae: Salticidae)	Genus			24		251	260	2013					http://www.wsc.nmbe.ch/reference/12487		Wiśniewski, K. & Wesołowska, W. (2013a). New Thiratoscirtus species from equatorial Africa (Araneae: Salticidae). Genus 24: 251-260.
12520	K Wiśniewski;W Wesołowska	Hasarius firmus sp. nov., a new spider species from Cameroon (Araneae: Salticidae)	Genus			24	3-4	503	507	2013					http://www.wsc.nmbe.ch/reference/12520		Wiśniewski, K. & Wesołowska, W. (2013b). Hasarius firmus sp. nov., a new spider species from Cameroon (Araneae: Salticidae). Genus 24(3-4): 503-507.
12614	K Wiśniewski;R Rozwałka;W Wesołowska	The first record of Hahnia difficilis Harm, 1966 (Araneae, Hahniidae) in Poland	Fragmenta Faunistica, Warsaw			56	1	55	63	2013				10.3161/00159301ff2013.56.1.055	http://www.wsc.nmbe.ch/reference/12614		Wiśniewski, K., Rozwałka, R. & Wesołowska, W. (2013). The first record of Hahnia difficilis Harm, 1966 (Araneae, Hahniidae) in Poland. Fragmenta Faunistica, Warsaw 56(1): 55-63.
12293	T Yamasaki;G B Edwards	The genus Myrmarchne (Araneae, Salticidae) in Flores, Indonesia	ZooKeys			299		1	20	2013					http://www.wsc.nmbe.ch/reference/12293		Yamasaki, T. & Edwards, G. B. (2013). The genus Myrmarchne (Araneae, Salticidae) in Flores, Indonesia. ZooKeys 299: 1-20.
12488	T Yamasaki	A new species of the genus Myrmarchne (Araneae, Salticidae) from Tamsui, Taiwan	Acta Arachnologica			62		29	31	2013				10.2476/asjaa.62.29	http://www.wsc.nmbe.ch/reference/12488		Yamasaki, T. (2013). A new species of the genus Myrmarchne (Araneae, Salticidae) from Tamsui, Taiwan. Acta Arachnologica 62: 29-31.
12489	T Yamasaki;A H Ahmad	Taxonomic study of the genus Myrmarachne of Borneo (Araneae: Salticidae)	Zootaxa			3710		501	556	2013					http://www.wsc.nmbe.ch/reference/12489		Yamasaki, T. & Ahmad, A. H. (2013). Taxonomic study of the genus Myrmarachne of Borneo (Araneae: Salticidae). Zootaxa 3710: 501-556.
12490	T B Yang;X Y Wang;Z Z Yang	Two new species of genus Otacilia from China (Araneae: Corinnidae)	Acta Arachnologica Sinica			22		9	15	2013					http://www.wsc.nmbe.ch/reference/12490		Yang, T. B., Wang, X. Y. & Yang, Z. Z. (2013). Two new species of genus Otacilia from China (Araneae: Corinnidae). Acta Arachnologica Sinica 22: 9-15.
12491	Z Z Yang;Z Yang;F Zhang	Description of a new Synaphosus (Araneae: Gnaphosidae) species from Mt. Cangshan, Yunnan, China	Acta Arachnologica			62		7	11	2013				10.2476/asjaa.62.7	http://www.wsc.nmbe.ch/reference/12491		Yang, Z. Z., Yang, Z. & Zhang, F. (2013). Description of a new Synaphosus (Araneae: Gnaphosidae) species from Mt. Cangshan, Yunnan, China. Acta Arachnologica 62: 7-11.
12294	Z Y Yao;M Tavano;S Q Li	Notes on four pholcid spiders (Araneae: Pholcidae) described by T. Thorell from southeast Asia	Zootaxa			3609		302	310	2013					http://www.wsc.nmbe.ch/reference/12294		Yao, Z. Y., Tavano, M. & Li, S. Q. (2013). Notes on four pholcid spiders (Araneae: Pholcidae) described by T. Thorell from southeast Asia. Zootaxa 3609: 302-310.
12492	Z Y Yao;S Q Li	New and little known pholcid spiders (Araneae: Pholcidae) from Laos	Zootaxa			3709		1	51	2013					http://www.wsc.nmbe.ch/reference/12492		Yao, Z. Y. & Li, S. Q. (2013). New and little known pholcid spiders (Araneae: Pholcidae) from Laos. Zootaxa 3709: 1-51.
12493	X L Yuan;X Yang;F Zhang	A new record species of the genus Pellenes (Araneae: Salticidae) from Xiaowutai Mountain, China	Acta Arachnologica Sinica			22		24	27	2013					http://www.wsc.nmbe.ch/reference/12493		Yuan, X. L., Yang, X. & Zhang, F. (2013). A new record species of the genus Pellenes (Araneae: Salticidae) from Xiaowutai Mountain, China. Acta Arachnologica Sinica 22: 24-27.
12295	B Zakharov;V Ovtcharenko	Male palp organ morphology of three species of ground spiders (Araneae, Gnaphosidae)	Arachnologische Mitteilungen			45		15	20	2013				10.5431/aramit4504	http://www.wsc.nmbe.ch/reference/12295		Zakharov, B. & Ovtcharenko, V. (2013a). Male palp organ morphology of three species of ground spiders (Araneae, Gnaphosidae). Arachnologische Mitteilungen 45: 15-20. doi:10.5431/aramit4504
12562	B P Zakharov;V I Ovtcharenko	Structure of genital organs and mating process of the spider Hemicloea sundevalli Thorell, 1870 (Araneae: Gnaphosidae)	Entomologica Americana			119	3 &amp; 4	47	56	2013				10.1664/13-RA-001.1	http://www.wsc.nmbe.ch/reference/12562		Zakharov, B. P. & Ovtcharenko, V. I. (2013b). Structure of genital organs and mating process of the spider Hemicloea sundevalli Thorell, 1870 (Araneae: Gnaphosidae). Entomologica Americana 119(3 &amp; 4): 47-56. doi:10.1664/13-RA-001.1
12296	J X Zhang;W P Maddison	Molecular phylogeny, divergence times and biogeography of spiders of the subfamily Euophryinae (Araneae: Salticidae)	Molecular Phylogenetics and Evolution			68		81	92	2013				10.1016/j.ympev.2013.03.017	http://www.wsc.nmbe.ch/reference/12296		Zhang, J. X. & Maddison, W. P. (2013). Molecular phylogeny, divergence times and biogeography of spiders of the subfamily Euophryinae (Araneae: Salticidae). Molecular Phylogenetics and Evolution 68: 81-92.
12297	Z S Zhang;S Q Li;D S Pham	First description of comb-tailed spiders (Araneae: Hahniidae) from Vietnam	Zootaxa			3613		343	356	2013					http://www.wsc.nmbe.ch/reference/12297		Zhang, Z. S., Li, S. Q. & Pham, D. S. (2013). First description of comb-tailed spiders (Araneae: Hahniidae) from Vietnam. Zootaxa 3613: 343-356.
12494	B S Zhang;F Zhang;Z S Zhang	Four new species of the genus Pseudopoda Jäger, 2000 (Araneae, Sparassidae) from Yunnan province, China	Zootaxa			3702		273	287	2013					http://www.wsc.nmbe.ch/reference/12494		Zhang, B. S., Zhang, F. & Zhang, Z. S. (2013a). Four new species of the genus Pseudopoda Jäger, 2000 (Araneae, Sparassidae) from Yunnan province, China. Zootaxa 3702: 273-287.
12495	F Zhang;B S Zhang;Z S Zhang	New species of Pseudopoda Jäger, 2000 from southern China (Araneae, Sparassidae)	ZooKeys			361		37	60	2013					http://www.wsc.nmbe.ch/reference/12495		Zhang, F., Zhang, B. S. & Zhang, Z. S. (2013b). New species of Pseudopoda Jäger, 2000 from southern China (Araneae, Sparassidae). ZooKeys 361: 37-60.
12496	Z S Zhang;Y G Zhang	Synonymy and misidentification of three Hahnia species (Araneae: Hahniidae) from China	Zootaxa			3682		521	533	2013					http://www.wsc.nmbe.ch/reference/12496		Zhang, Z. S. & Zhang, Y. G. (2013). Synonymy and misidentification of three Hahnia species (Araneae: Hahniidae) from China. Zootaxa 3682: 521-533.
12497	L Zhao;Y F Tong	A newly recorded species and genus of the goblin spiders from Hainan Island, China (Araneae: Oonopidae)	Acta Arachnologica Sinica			22		65	69	2013					http://www.wsc.nmbe.ch/reference/12497		Zhao, L. & Tong, Y. F. (2013). A newly recorded species and genus of the goblin spiders from Hainan Island, China (Araneae: Oonopidae). Acta Arachnologica Sinica 22: 65-69.
12498	Y Zhao;X J Peng	Three new species of spiders of the family Liocranidae (Arachnida: Araneae) from China	Oriental Insects			47		176	183	2013					http://www.wsc.nmbe.ch/reference/12498		Zhao, Y. & Peng, X. J. (2013). Three new species of spiders of the family Liocranidae (Arachnida: Araneae) from China. Oriental Insects 47: 176-183.
12499	G C Zhou;L Y Wang;Z S Zhang	Two new corinnid spiders from Simian Mountain of Chongqing, China (Araneae: Corinnidae)	Acta Arachnologica Sinica			22		1	8	2013					http://www.wsc.nmbe.ch/reference/12499		Zhou, G. C., Wang, L. Y. & Zhang, Z. S. (2013). Two new corinnid spiders from Simian Mountain of Chongqing, China (Araneae: Corinnidae). Acta Arachnologica Sinica 22: 1-8.
12500	Y Y Zhou;S Q Li	Two new genera of jumping spiders from Hainan Island, China (Araneae, Salticidae)	Zootaxa			3712		1	84	2013					http://www.wsc.nmbe.ch/reference/12500		Zhou, Y. Y. & Li, S. Q. (2013a). Two new genera of jumping spiders from Hainan Island, China (Araneae, Salticidae). Zootaxa 3712: 1-84.
12501	Y Y Zhou;S Q Li	Sinoinsula, a name to replace Insula (Araneae, Salticidae)	Acta Arachnologica Sinica			21		95		2013					http://www.wsc.nmbe.ch/reference/12501		Zhou, Y. Y. & Li, S. Q. (2013b). Sinoinsula, a name to replace Insula (Araneae, Salticidae). Acta Arachnologica Sinica 21: 95.
12502	T Zinov	Anomalies of visual organs amongst tarantulas: absence of eyes in Lasiodora parahybana	Journal of the British Tarantula Society			28		117	120	2013					http://www.wsc.nmbe.ch/reference/12502		Zinov, T. (2013). Anomalies of visual organs amongst tarantulas: absence of eyes in Lasiodora parahybana. Journal of the British Tarantula Society 28: 117-120.
12503	S Zonstein;Y M Marusik	On Levymanus, a remarkable new spider genus from Israel, with notes on the Chediminae (Araneae, Palpimanidae)	ZooKeys			326		27	45	2013					http://www.wsc.nmbe.ch/reference/12503		Zonstein, S. & Marusik, Y. M. (2013). On Levymanus, a remarkable new spider genus from Israel, with notes on the Chediminae (Araneae, Palpimanidae). ZooKeys 326: 27-45.
12504	S L Zonstein;Y M Marusik;S Koponen	Redescription of three species of Filistatidae (Araneae) described by C.F. Roewer from Afghanistan	Zootaxa			3745		64	72	2013					http://www.wsc.nmbe.ch/reference/12504		Zonstein, S. L., Marusik, Y. M. & Koponen, S. (2013). Redescription of three species of Filistatidae (Araneae) described by C.F. Roewer from Afghanistan. Zootaxa 3745: 64-72.
12628	M Ahmed;J Anam;M K Saikia;S V Manthen;P K Saikia	Records of new genus Chrysilla (group spider: sub-order: Araneae: family: Salticidae) in India at agroecosystem, at Sonitpur, Assam	Journal on New Biological Reports			3	1	38	43	2014					http://www.wsc.nmbe.ch/reference/12628		Ahmed, M., Anam, J., Saikia, M. K., Manthen, S. V. & Saikia, P. K. (2014a). Records of new genus Chrysilla (group spider: sub-order: Araneae: family: Salticidae) in India at agroecosystem, at Sonitpur, Assam. Journal on New Biological Reports 3(1): 38-43.
12782	M Ahmed;J Anam;M K Saikia;S V Manthen;P K Saikia	New records spider species under Wadicosa genus (Sub-order: Araneae; Family: Lycosidae) from agricultural field of Sonitpur District, Assam, India	Journal on New Biological Reports			3	1	60	65	2014					http://www.wsc.nmbe.ch/reference/12782		Ahmed, M., Anam, J., Saikia, M. K., Manthen, S. V. & Saikia, P. K. (2014b). New records spider species under Wadicosa genus (Sub-order: Araneae; Family: Lycosidae) from agricultural field of Sonitpur District, Assam, India. Journal on New Biological Reports 3(1): 60-65.
12796	A Akpinar;M İ Varol	Two new records of genus Zodarion from Turkey (Araneae, Zodariidae)	Serket			14	2	102	104	2014					http://www.wsc.nmbe.ch/reference/12796		Akpinar, A. & Varol, M. İ. (2014). Two new records of genus Zodarion from Turkey (Araneae, Zodariidae). Serket 14(2): 102-104.
12629	H Allahverdi;G Gündüz	A new record for the araneofauna of Turkey	Serket			14	1	19	21	2014					http://www.wsc.nmbe.ch/reference/12629		Allahverdi, H. & Gündüz, G. (2014). A new record for the araneofauna of Turkey. Serket 14(1): 19-21.
12573	G N Azarkina;O Mirshamsi	Description of a new Aelurillus species from Khorasan province of Iran, with comments on A. concolor Kulczyński, 1901 (Araneae: Salticidae)	Zoology in the Middle East			60	1	82	91	2014				10.1080/09397140.2014.892353	http://www.wsc.nmbe.ch/reference/12573		Azarkina, G. N. & Mirshamsi, O. (2014). Description of a new Aelurillus species from Khorasan province of Iran, with comments on A. concolor Kulczyński, 1901 (Araneae: Salticidae). Zoology in the Middle East 60(1): 82-91. doi:10.1080/09397140.2014.892353
12822	G N Azarkina;S H Foord	A revision of the Afrotropical species of Festucula Simon, 1901 (Araneae: Salticidae)	African Invertebrates			55	2	351	375	2014					http://www.wsc.nmbe.ch/reference/12822		Azarkina, G. N. & Foord, S. H. (2014). A revision of the Afrotropical species of Festucula Simon, 1901 (Araneae: Salticidae). African Invertebrates 55(2): 351-375.
12601	L Baert	Three new Eustala (Araneae, Araneidae) species from the Galápagos Islands (Ecuador)	European Journal of Taxonomy			86		1	18	2014				10.5852/ejt.2014.86	http://www.wsc.nmbe.ch/reference/12601		Baert, L. (2014b). Three new Eustala (Araneae, Araneidae) species from the Galápagos Islands (Ecuador). European Journal of Taxonomy 86: 1-18. doi:10.5852/ejt.2014.86
